Symbol,Name,Last Sale,Net Change,% Change,Market Cap,Country,IPO Year,Volume,Sector,Industry
RDNT,RadNet Inc. Common Stock,$28.26 ,-0.6,-2.08%,1501697627,United States,,130580,Health Care,Medical Specialities
RDUS,Radius Health Inc. Common Stock,$13.47 ,0.46,3.54%,636674987,United States,2014,268240,Health Care,Biotechnology: Pharmaceutical Preparations
RDVT,Red Violet Inc. Common Stock ,$28.46 ,-0.04,-0.14%,363588311,United States,,4081,Technology,Computer Software: Prepackaged Software
RDWR,Radware Ltd. Ordinary Shares,$33.71 ,-0.65,-1.89%,1534982827,Israel,1999,183361,Miscellaneous,Business Services
REAL,The RealReal Inc. Common Stock,$11.69 ,-0.36,-2.99%,1070424601,United States,2019,3459430,Consumer Services,Catalog/Specialty Distribution
REAX,The Real Brokerage Inc. Common Shares,$1.81 ,-0.01,-0.55%,322189579,Canada,,85882,,
REDU,RISE Education Cayman Ltd American Depositary Shares,$0.67 ,-0.0205,-2.98%,37674098,China,2017,237011,Miscellaneous,Service to the Health Industry
REE,REE Automotive Ltd. Class A Ordinary Shares,$4.00 ,-0.2,-4.76%,1253373368,Israel,,400453,,
REEAW,REE Automotive Ltd. Warrant,$0.80 ,-0.0175,-2.14%,0,Israel,,11078,,
REED,Reeds Inc. Common Stock,$0.62 ,0.0017,0.27%,58504942,United States,,736787,Consumer Non-Durables,Beverages (Production/Distribution)
REFR,Research Frontiers Incorporated Common Stock,$2.41 ,-0.0047,-0.20%,76128697,United States,,53175,Capital Goods,Industrial Machinery/Components
REKR,Rekor Systems Inc. Common Stock,$11.97 ,0.23,1.96%,524765363,United States,,1339115,Technology,EDP Services
RELI,Reliance Global Group Inc. Common Stock,$2.67 ,0.05,1.91%,29221652,United States,,17153,Finance,Specialty Insurers
RELIW,Reliance Global Group Inc. Series A Warrants,$0.60 ,0,0.00%,0,United States,,85,Finance,Specialty Insurers
RELL,Richardson Electronics Ltd. Common Stock,$11.57 ,-0.08,-0.69%,152812557,United States,1983,299202,Technology,Electronic Components
REPH,Recro Pharma Inc. Common Stock,$1.90 ,0,0.00%,88567617,United States,2014,460473,Health Care,Biotechnology: Pharmaceutical Preparations
REPL,Replimune Group Inc. Common Stock,$30.97 ,0.53,1.74%,1448536985,United States,2018,162902,Health Care,Biotechnology: Pharmaceutical Preparations
RESN,Resonant Inc. Common Stock,$2.35 ,-0.13,-5.24%,148106941,United States,2014,649972,Technology,Semiconductors
RETO,ReTo Eco-Solutions Inc. Common Shares,$0.78 ,-0.0097,-1.23%,21214247,China,2017,18193,Capital Goods,Multi-Sector Companies
REVEU,Alpine Acquisition Corporation Unit,$10.18 ,0,0.00%,0,United States,2021,19747,,
REVH,Revolution Healthcare Acquisition Corp. SAIL Class A Common Stock,$9.75 ,-0.01,-0.10%,563062500,United States,2021,3160,,
REVHU,Revolution Healthcare Acquisition Corp. SAIL Units,$9.90 ,-0.0433,-0.44%,0,United States,2021,417,,
REVHW,Revolution Healthcare Acquisition Corp. SAIL Warrant.,$0.82 ,0.0001,0.01%,0,United States,2021,86145,,
RFIL,RF Industries Ltd. Common Stock,$7.79 ,0.07,0.91%,78216258,United States,,20438,Capital Goods,Electrical Products
RGC,Regencell Bioscience Holdings Limited Ordinary Shares,$19.11 ,-0.59,-3.00%,241647957,Hong Kong,2021,41468,,
RGCO,RGC Resources Inc. Common Stock,$22.73 ,0.31,1.38%,189917242,United States,,19957,Public Utilities,Oil & Gas Production
RGLS,Regulus Therapeutics Inc. Common Stock,$0.70 ,0.0183,2.70%,60667113,United States,2012,740627,Health Care,Biotechnology: Pharmaceutical Preparations
RGNX,REGENXBIO Inc. Common Stock,$31.67 ,-0.82,-2.52%,1349158722,United States,2015,334865,Health Care,Biotechnology: Biological Products (No Diagnostic Substances)
RGP,Resources Connection Inc. Common Stock,$17.82 ,-1.43,-7.43%,591387707,United States,,676664,Miscellaneous,Business Services
RIBT,RiceBran Technologies Common Stock,$0.55 ,-0.0094,-1.67%,25548983,United States,,236454,Consumer Non-Durables,Specialty Foods
RICK,RCI Hospitality Holdings Inc. Common Stock,$71.94 ,-2.49,-3.35%,647453525,United States,1995,39814,Consumer Services,Restaurants
RICO,Agrico Acquisition Corp. Class A Ordinary Shares,$10.00 ,0,0.00%,181125000,Cayman Islands,2021,39661,,
RICOW,Agrico Acquisition Corp. Warrant,$0.42 ,-0.0001,-0.02%,0,Cayman Islands,2021,8900,,
RIDE,Lordstown Motors Corp. Class A Common Stock,$4.89 ,-0.15,-2.98%,882904219,United States,2019,8393438,Capital Goods,Construction/Ag Equipment/Trucks
RIGL,Rigel Pharmaceuticals Inc. Common Stock,$3.44 ,-0.08,-2.27%,587725053,United States,2000,1181229,Health Care,Biotechnology: Pharmaceutical Preparations
RILY,B. Riley Financial Inc. Common Stock,$59.55 ,-0.49,-0.82%,1642406865,United States,,55785,Finance,Investment Managers
RILYI,B. Riley Financial Inc. 6.875% Senior Notes due 2023,$25.69 ,0.03,0.12%,0,United States,,5797,Miscellaneous,Business Services
RILYK,B. Riley Financial Inc. 5.50% Senior Notes Due 2026,$25.71 ,0.07,0.27%,0,United States,,4716,Miscellaneous,Business Services
RILYL,B. Riley Financial Inc. Depositary Shares each representing 1/1000th in a share of 7.375% Series B Cumulative Perpetual Preferred Stock par value $0.0001,$27.89 ,0.2899,1.05%,0,United States,,1134,Finance,Investment Managers
RILYM,B. Riley Financial Inc. 6.375% Senior Notes due 2025,$25.98 ,-0.0239,-0.09%,0,United States,,2918,Miscellaneous,Business Services
RILYN,B. Riley Financial Inc. 6.50% Senior Notes Due 2026,$26.29 ,0.0172,0.07%,0,United States,,6494,Miscellaneous,Business Services
RILYO,B. Riley Financial Inc. 6.75% Senior Notes due 2024,$25.90 ,0.079,0.31%,0,United States,,2184,Miscellaneous,Business Services
RILYP,B. Riley Financial Inc. Depositary Shares each representing a 1/1000th fractional interest in a share of Series A Cumulative Perpetual Preferred Stock,$26.98 ,-0.01,-0.04%,0,United States,,948,Finance,Investment Managers
RILYT,B. Riley Financial Inc. 6.00% Senior Notes Due 2028,$25.67 ,0.0088,0.03%,0,United States,,4380,Miscellaneous,Business Services
RILYZ,B. Riley Financial Inc. 5.25% Senior Notes due 2028,$25.05 ,0,0.00%,0,United States,,52957,Miscellaneous,Business Services
RIVE,Riverview Financial Corporation Common Stock,$12.99 ,-0.34,-2.55%,121611951,United States,,8622,Finance,Major Banks
RKDA,Arcadia Biosciences Inc. Common Stock,$2.06 ,-0.04,-1.91%,45677719,United States,2015,190634,Basic Industries,Agricultural Chemicals
RKLB,Rocket Lab USA Inc. Common Stock,$14.71 ,-0.75,-4.85%,0,United States,2020,16559180,Capital Goods,Aerospace
RKLBW,Rocket Lab USA Inc. Warrant,$4.87 ,0.0899,1.88%,0,United States,2020,173347,Capital Goods,Aerospace
RLMD,Relmada Therapeutics Inc. Common Stock,$26.17 ,-0.27,-1.02%,457268044,United States,,26718,Health Care,Biotechnology: Pharmaceutical Preparations
RLYB,Rallybio Corporation Common Stock,$17.73 ,-1.22,-6.44%,569664368,United States,2021,74708,Health Care,Biotechnology: Pharmaceutical Preparations
RMBI,Richmond Mutual Bancorporation Inc. Common Stock,$15.66 ,-0.02,-0.13%,195356636,United States,2019,5047,,
RMBL,RumbleOn Inc. Class B Common Stock,$37.15 ,-0.65,-1.72%,553530542,United States,,32188,Capital Goods,Automotive Aftermarket
RMCF,Rocky Mountain Chocolate Factory Inc. Common Stock,$7.50 ,-0.18,-2.34%,45932160,United States,,16705,Consumer Non-Durables,Specialty Foods
RMGC,RMG Acquisition Corp. III Class A Ordinary Shares,$9.76 ,-0.0054,-0.06%,589537725,United States,2021,710973,Finance,Business Services
RMGCU,RMG Acquisition Corp. III Unit,$9.87 ,-0.03,-0.30%,0,United States,2021,200,Finance,Business Services
RMGCW,RMG Acquisition Corp. III Warrant,$0.92 ,0.0107,1.17%,0,United States,2021,608,Finance,Business Services
RMNI,Rimini Street Inc. (DE) Common Stock,$10.92 ,0.07,0.65%,936542880,United States,2015,819521,Technology,EDP Services
RMR,The RMR Group Inc. Class A Common Stock,$33.35 ,-0.21,-0.63%,547204566,United States,,30839,Finance,Real Estate
RMTI,Rockwell Medical Inc. (DE) Common Stock,$0.57 ,0.0015,0.26%,53507273,United States,1998,338745,Health Care,Biotechnology: Pharmaceutical Preparations
RNA,Avidity Biosciences Inc. Common Stock,$22.93 ,-1.07,-4.46%,1074729031,United States,2020,101348,Health Care,Biotechnology: Pharmaceutical Preparations
RNAZ,TransCode Therapeutics Inc. Common Stock,$2.75 ,-0.05,-1.79%,35487579,United States,2021,243214,Health Care,Biotechnology: Pharmaceutical Preparations
RNDB,Randolph Bancorp Inc. Common Stock,$21.25 ,-0.68,-3.10%,111335530,United States,2016,244,Finance,Major Banks
RNERU,Mount Rainier Acquisition Corp. Unit,$10.08 ,-0.01,-0.10%,0,United States,2021,947459,,
RNLX,Renalytix plc American Depositary Shares,$21.00 ,-0.2,-0.94%,758527413,United Kingdom,2020,22537,Health Care,Medical Specialities
RNWK,RealNetworks Inc. Common Stock,$1.47 ,-0.05,-3.29%,69099927,United States,1997,188509,Technology,EDP Services
RNWWW,ReNew Energy Global plc Warrant,$1.73 ,-0.005,-0.29%,0,United Kingdom,,18985,,
RNXT,RenovoRx Inc. Common Stock,$5.71 ,-0.44,-7.15%,47874730,United States,2021,190071,Health Care,Biotechnology: Pharmaceutical Preparations
ROAD,Construction Partners Inc. Class A Common Stock,$33.77 ,-0.33,-0.97%,1765916982,United States,2018,51420,Capital Goods,Engineering & Construction
ROCG,Roth CH Acquisition IV Co. Common Stock,$9.84 ,-0.03,-0.30%,145991160,United States,2021,1228,,
ROCGU,Roth CH Acquisition IV Co. Unit,$10.10 ,0,0.00%,0,United States,2021,1328,,
ROCGW,Roth CH Acquisition IV Co. Warrant,$0.55 ,-0.0499,-8.32%,0,United States,2021,1213,,
ROCR,Roth CH Acquisition III Co. Common stock,$9.95 ,0.01,0.10%,147090850,United States,2021,18038,,
ROCRU,Roth CH Acquisition III Co. Unit,$10.15 ,0,0.00%,0,United States,2021,200,,
ROCRW,Roth CH Acquisition III Co. Warrant,$1.30 ,-0.03,-2.26%,0,United States,2021,2145,,
ROIV,Roivant Sciences Ltd. Common Shares,$6.41 ,0.23,3.72%,0,United Kingdom,,547200,,
ROIVW,Roivant Sciences Ltd. Warrant,$1.07 ,0.01,0.94%,0,United Kingdom,,273002,,
ROLLP,RBC Bearings Incorporated 5.00% Series A Mandatory Convertible Preferred Stock,$112.25 ,-1.3671,-1.20%,0,United States,,15343,Capital Goods,Metal Fabrications
ROOT,Root Inc. Class A Common Stock,$5.00 ,-0.15,-2.91%,1268477270,United States,2020,3502456,Finance,Property-Casualty Insurers
ROVR,Rover Group Inc. Class A Common Stock,$12.12 ,0.1,0.83%,1905222501,United States,2021,140175,Miscellaneous,Other Consumer Services
ROVRW,Rover Group Inc. Warrant,$3.18 ,0.06,1.92%,0,United States,2021,2566,Miscellaneous,Other Consumer Services
RPHM,Reneo Pharmaceuticals Inc. Common Stock,$6.55 ,-0.37,-5.35%,159854892,United States,2021,10631,Health Care,Biotechnology: Pharmaceutical Preparations
RPID,Rapid Micro Biosystems Inc. Class A Common Stock,$18.45 ,0.27,1.49%,757963177,United States,2021,123155,Health Care,Medical Specialities
RPTX,Repare Therapeutics Inc. Common Shares,$20.46 ,-1.44,-6.58%,759414147,Canada,2020,1926796,,
RRBI,Red River Bancshares Inc. Common Stock,$51.28 ,-0.92,-1.76%,373138048,United States,2019,2282,Finance,Commercial Banks
RRGB,Red Robin Gourmet Burgers Inc. Common Stock,$21.91 ,-0.66,-2.92%,344214557,United States,2002,288099,Consumer Services,Restaurants
RSLS,ReShape Lifesciences Inc. Common Stock,$3.13 ,0.65,26.21%,49586039,United States,2016,31710216,Health Care,Biotechnology: Electromedical & Electrotherapeutic Apparatus
RSSS,Research Solutions Inc Common Stock,$2.71 ,-0.03,-1.10%,71948112,United States,,11675,Technology,Retail: Computer Software & Peripheral Equipment
RSVR,Reservoir Media Inc. Common Stock,$8.75 ,0.48,5.80%,560605964,United States,2021,144201,Consumer Services,Movies/Entertainment
RSVRW,Reservoir Media Inc. Warrant,$1.97 ,0.09,4.79%,0,United States,2021,19697,Consumer Services,Movies/Entertainment
RTLR,Rattler Midstream LP Common Units,$12.06 ,0.29,2.46%,1792014165,United States,2019,56287,Energy,Oilfield Services/Equipment
RTPY,Reinvent Technology Partners Y Class A Ordinary Shares,$9.94 ,0,0.00%,1214543750,United States,2021,838427,Finance,Business Services
RTPYU,Reinvent Technology Partners Y Unit,$10.12 ,0.0327,0.32%,0,United States,2021,7418,Finance,Business Services
RTPYW,Reinvent Technology Partners Y Warrant,$1.47 ,0.07,5.00%,0,United States,2021,74728,Finance,Business Services
RUBY,Rubius Therapeutics Inc. Common Stock,$15.96 ,-0.43,-2.62%,1432791157,United States,2018,178800,Health Care,Biotechnology: Biological Products (No Diagnostic Substances)
RUTH,Ruth's Hospitality Group Inc. Common Stock,$19.19 ,-0.69,-3.47%,668045715,United States,2005,352256,Consumer Services,Restaurants
RVACU,Riverview Acquisition Corp. Unit,$9.90 ,0.02,0.20%,0,United States,2021,36158,,
RVNC,Revance Therapeutics Inc. Common Stock,$26.83 ,0.27,1.02%,1927191334,United States,2014,193476,Health Care,Biotechnology: Pharmaceutical Preparations
RVPH,Reviva Pharmaceuticals Holdings Inc. Common Stock ,$3.95 ,-0.06,-1.50%,20281484,United States,2020,28788,Health Care,Biotechnology: Pharmaceutical Preparations
RVPHW,Reviva Pharmaceuticals Holdings Inc. Warrants,$0.37 ,-0.0003,-0.08%,0,United States,2018,2140,Health Care,Biotechnology: Pharmaceutical Preparations
RVSB,Riverview Bancorp Inc Common Stock,$7.21 ,-0.09,-1.23%,159393828,United States,,18759,Finance,Major Banks
RWLK,ReWalk Robotics Ltd. Ordinary Shares,$1.34 ,-0.01,-0.74%,83681385,Israel,2014,2815656,Health Care,Industrial Specialties
RXDX,Prometheus Biosciences Inc. Common Stock,$25.06 ,0.09,0.36%,973981609,United States,2021,93331,Health Care,Biotechnology: Pharmaceutical Preparations
RXRA,RXR Acquisition Corp. Class A Common Stock,$9.71 ,0,0.00%,418743750,United States,2021,1,,
RXRAU,RXR Acquisition Corp. Units,$9.90 ,0,0.00%,0,United States,2021,112,,
RXRAW,RXR Acquisition Corp. Warrants to purchase Class A common stock,$0.76 ,-0.0749,-8.97%,0,United States,2021,10016,,
RXST,RxSight Inc. Common Stock,$12.62 ,-0.58,-4.39%,344690110,United States,2021,26480,Health Care,Biotechnology: Electromedical & Electrotherapeutic Apparatus
RYTM,Rhythm Pharmaceuticals Inc. Common Stock,$11.50 ,-0.33,-2.79%,577616124,United States,2017,293197,Health Care,Biotechnology: Pharmaceutical Preparations
RZLT,Rezolute Inc. Common Stock (NV),$7.42 ,0.355,5.03%,63961676,United States,,8744,Health Care,Biotechnology: Pharmaceutical Preparations
SABRP,Sabre Corporation 6.50% Series A Mandatory Convertible Preferred Stock,$145.42 ,-4.37,-2.92%,0,United States,,2391,Technology,EDP Services
SAFT,Safety Insurance Group Inc. Common Stock,$81.72 ,0.61,0.75%,1224362137,United States,2002,31398,Finance,Property-Casualty Insurers
SAL,Salisbury Bancorp Inc. Common Stock,$51.92 ,0.0516,0.10%,148579308,United States,,281,Finance,Savings Institutions
SALM,Salem Media Group Inc. Class A Common Stock,$3.58 ,0.04,1.13%,96191539,United States,1999,222202,Consumer Services,Broadcasting
SAMAU,Schultze Special Purpose Acquisition Corp. II Units,$9.92 ,-0.08,-0.80%,0,United States,,8741427,Finance,Business Services
SAMG,Silvercrest Asset Management Group Inc. Class A Common Stock,$15.74 ,-0.01,-0.06%,227468247,United States,2013,14715,Finance,Investment Managers
SANW,S&W Seed Company Common Stock (NV),$2.52 ,-0.06,-2.33%,92678277,United States,,32429,,Farming/Seeds/Milling
SBEA,SilverBox Engaged Merger Corp I Class A Common Stock,$9.77 ,0,0.00%,421331250,United States,2021,117,,
SBEAU,SilverBox Engaged Merger Corp I Units,$9.99 ,0.03,0.30%,0,United States,2021,2000,,
SBEAW,SilverBox Engaged Merger Corp I Warrant,$0.60 ,0,0.00%,0,United States,2021,40,,
SBET,SharpLink Gaming Ltd. Ordinary Shares,$4.45 ,-0.11,-2.41%,65930670,Israel,,1509087,Public Utilities,Telecommunications Equipment
SBFG,SB Financial Group Inc. Common Stock,$18.55 ,0.25,1.37%,130060301,United States,,3784,Finance,Major Banks
SBNYP,Signature Bank Depositary shares each representing a 1/40th ownership interest in a share of 5.000% Noncumulative Perpetual Series A Preferred Stock,$25.93 ,0.06,0.23%,0,United States,,29784,Finance,Major Banks
SBSI,Southside Bancshares Inc. Common Stock,$38.99 ,-0.11,-0.28%,1273173845,United States,,30147,Finance,Major Banks
SBT,Sterling Bancorp Inc. Common Stock,$5.16 ,-0.02,-0.39%,260451934,United States,2017,107080,Finance,Savings Institutions
SBTX,Silverback Therapeutics Inc. Common Stock,$9.64 ,-0.5,-4.93%,337751638,United States,2020,307877,Consumer Durables,Specialty Chemicals
SCAQ,Stratim Cloud Acquisition Corp. Class A Common Stock,$9.78 ,0.04,0.41%,305625000,United States,2021,13512,,
SCAQW,Stratim Cloud Acquisition Corp. Warrant,$0.63 ,0,0.00%,0,United States,2021,503,,
SCHL,Scholastic Corporation Common Stock,$36.65 ,-0.41,-1.11%,1261126390,United States,1992,72053,Consumer Services,Books
SCHN,Schnitzer Steel Industries Inc. Class A Common Stock,$48.42 ,-0.05,-0.10%,1332692228,United States,1993,164872,Basic Industries,Steel/Iron Ore
SCKT,Socket Mobile Inc. Common Stock,$6.40 ,0.05,0.79%,45914963,United States,,32903,Technology,Computer Manufacturing
SCLE,Broadscale Acquisition Corp. Class A common stock,$9.75 ,0.02,0.21%,420468750,United States,2021,1037522,,
SCLEU,Broadscale Acquisition Corp. Units,$9.92 ,-0.01,-0.10%,0,United States,2021,527493,,
SCLEW,Broadscale Acquisition Corp. Warrant,$0.76 ,-0.022,-2.81%,0,United States,2021,144078,,
SCOA,ScION Tech Growth I Class A Ordinary Shares,$9.79 ,0.015,0.15%,703296875,United Kingdom,2021,212257,Finance,Business Services
SCOAU,ScION Tech Growth I Unit,$10.08 ,0.08,0.80%,0,United Kingdom,2020,200,Finance,Business Services
SCOAW,ScION Tech Growth I Warrant,$0.75 ,-0.0107,-1.41%,0,United Kingdom,2021,23172,Finance,Business Services
SCOB,ScION Tech Growth II Class A Ordinary Shares,$9.77 ,0,0.00%,421331250,United Kingdom,2021,100022,Finance,Business Services
SCOBU,ScION Tech Growth II Units,$9.97 ,-0.0227,-0.23%,0,United Kingdom,2021,390,Finance,Business Services
SCOBW,ScION Tech Growth II Warrants,$0.72 ,-0.0201,-2.72%,0,United Kingdom,2021,100100,Finance,Business Services
SCOR,comScore Inc. Common Stock,$3.71 ,-0.01,-0.27%,304926985,United States,2018,183850,Miscellaneous,Business Services
SCPH,scPharmaceuticals Inc. Common Stock,$6.67 ,0.02,0.30%,182460878,United States,2017,17071,Health Care,Biotechnology: Pharmaceutical Preparations
SCPL,SciPlay Corporation Class A Common Stock,$19.80 ,-0.49,-2.42%,483993200,United States,2019,429628,Technology,Computer Software: Prepackaged Software
SCPS,Scopus BioPharma Inc. Common Stock,$4.28 ,0.17,4.14%,77443450,United States,2020,38994,Health Care,Biotechnology: Pharmaceutical Preparations
SCR,Score Media and Gaming Inc. Class A Subordinate Voting Shares,$34.49 ,-0.47,-1.34%,1928487897,Canada,,551791,,
SCSC,ScanSource Inc. Common Stock,$36.68 ,-0.01,-0.03%,935320376,United States,,59402,Technology,Retail: Computer Software & Peripheral Equipment
SCVL,Shoe Carnival Inc. Common Stock,$32.59 ,-1.62,-4.74%,920291086,United States,1993,185971,Consumer Services,Clothing/Shoe/Accessory Stores
SCWX,SecureWorks Corp. Class A Common Stock,$23.21 ,0.87,3.89%,1980954955,United States,2016,152947,Technology,EDP Services
SCYX,SCYNEXIS Inc. Common Stock,$5.14 ,-0.03,-0.58%,119340052,United States,2014,155015,Health Care,Biotechnology: Pharmaceutical Preparations
SDAC,Sustainable Development Acquisition I Corp. Class A Common Stock,$9.80 ,0.08,0.82%,387406250,United States,2021,54191,,
SDACU,Sustainable Development Acquisition I Corp. Unit,$10.11 ,0.11,1.10%,0,United States,2021,242,,
SDACW,Sustainable Development Acquisition I Corp. Warrant,$0.64 ,0.0005,0.08%,0,United States,2021,7026,,
SDH,Global Internet of People Inc. Ordinary Shares,$2.19 ,0.12,5.80%,53716320,China,2021,10787,Miscellaneous,Business Services
SEAC,SeaChange International Inc. Common Stock,$1.01 ,-0.02,-1.94%,49530656,United States,1996,257568,Technology,Radio And Television Broadcasting And Communications Equipment
SECO,Secoo Holding Limited ADR,$1.34 ,-0.02,-1.47%,94674433,China,2017,12077,Miscellaneous,Diversified Commercial Services
SEED,Origin Agritech Limited Common Stock,$10.03 ,1.01,11.20%,57184821,China,,635124,,Farming/Seeds/Milling
SEEL,Seelos Therapeutics Inc. Common Stock,$2.24 ,-0.08,-3.45%,229186066,United States,,2491363,Health Care,Biotechnology: Pharmaceutical Preparations
SELB,Selecta Biosciences Inc. Common Stock,$4.28 ,0.02,0.47%,492539370,United States,2016,391179,Health Care,Biotechnology: Pharmaceutical Preparations
SELF,Global Self Storage Inc. Common Stock,$5.32 ,-0.01,-0.19%,56969821,United States,,11516,Consumer Services,Real Estate Investment Trusts
SENEA,Seneca Foods Corp. Class A Common Stock,$53.12 ,-0.57,-1.06%,472300916,United States,,23318,Consumer Non-Durables,Packaged Foods
SENEB,Seneca Foods Corp. Class B Common Stock,$51.25 ,0,0.00%,455674359,United States,,49,Consumer Non-Durables,Packaged Foods
SERA,Sera Prognostics Inc. Class A Common Stock,$11.11 ,0.27,2.49%,325454462,United States,2021,80663,Health Care,Precision Instruments
SESN,Sesen Bio Inc. Common Stock,$0.73 ,-0.0057,-0.77%,143924724,United States,2014,3426883,Health Care,Biotechnology: Pharmaceutical Preparations
SEVN,Seven Hills Realty Trust Common Stock,$10.50 ,0.07,0.67%,152267651,United States,,65625,Consumer Services,Real Estate Investment Trusts
SFBC,Sound Financial Bancorp Inc. Common Stock,$45.60 ,-0.0206,-0.05%,119360305,United States,,1106,Finance,Savings Institutions
SFET,Safe-T Group Ltd. American Depositary Share,$1.05 ,-0.01,-0.94%,31453108,Israel,2018,52020,Technology,Computer Software: Prepackaged Software
SFST,Southern First Bancshares Inc. Common Stock,$53.92 ,-0.08,-0.15%,425964280,United States,,12619,Finance,Major Banks
SFT,Shift Technologies Inc. Class A Common Stock,$6.66 ,-0.18,-2.63%,560608830,United States,2019,741375,Miscellaneous,Diversified Commercial Services
SGA,Saga Communications Inc. Class A Common Stock (FL),$22.50 ,0.15,0.67%,134558843,United States,,1163,Consumer Services,Broadcasting
SGAM,Seaport Global Acquisition Corp. Class A Common Stock,$10.08 ,0.005,0.05%,181125000,United States,2020,70949,,
SGAMU,Seaport Global Acquisition Corp. Unit,$11.76 ,0,0.00%,0,United States,2020,25,,
SGAMW,Seaport Global Acquisition Corp. Warrant,$0.90 ,0.01,1.12%,0,United States,2020,10664,,
SGBX,SG Blocks Inc. Common Stock,$3.25 ,-0.05,-1.52%,28673089,United States,2017,47372,Basic Industries,Metal Fabrications
SGC,Superior Group of Companies Inc. Common Stock,$24.53 ,0.06,0.25%,390798370,United States,,19705,,
SGH,SMART Global Holdings Inc. Ordinary Shares,$44.07 ,-0.64,-1.43%,1069169666,United States,2017,303330,Technology,Semiconductors
SGHT,Sight Sciences Inc. Common Stock,$21.95 ,-1.8,-7.58%,1037470350,United States,2021,246380,Health Care,Medical Specialities
SGLB,Sigma Labs Inc. Common Stock,$3.18 ,0.02,0.63%,18539400,United States,,84521,Technology,EDP Services
SGLBW,Sigma Labs Inc. Warrant,$0.17 ,-0.0116,-6.38%,0,United States,,500,Technology,EDP Services
SGMA,SigmaTron International Inc. Common Stock,$9.32 ,-0.04,-0.43%,39931615,United States,1994,36492,Technology,Electrical Products
SGML,Sigma Lithium Corporation Common Shares,$8.62 ,-0.08,-0.92%,753113987,Canada,,75099,Capital Goods,Industrial Machinery/Components
SGMO,Sangamo Therapeutics Inc. Common Stock,$8.77 ,-0.09,-1.02%,1274605893,United States,2000,430921,Health Care,Biotechnology: Biological Products (No Diagnostic Substances)
SGOC,SGOCO Group Ltd Ordinary Shares (Cayman Islands),$5.72 ,-0.43,-6.99%,581140549,China,2010,456686,Technology,Radio And Television Broadcasting And Communications Equipment
SGRP,SPAR Group Inc. Common Stock,$1.45 ,-0.01,-0.69%,30933388,United States,,23776,Miscellaneous,Business Services
SGTX,Sigilon Therapeutics Inc. Common Stock,$5.19 ,-0.08,-1.52%,166377143,United States,2020,43680,Consumer Durables,Specialty Chemicals
SHAC,SCP & CO Healthcare Acquisition Company Class A Common Stock,$9.76 ,0,0.00%,280600000,United States,2021,718,,
SHACU,SCP & CO Healthcare Acquisition Company Unit,$10.03 ,0.03,0.30%,0,United States,2021,100,,
SHACW,SCP & CO Healthcare Acquisition Company Warrant,$0.62 ,-0.0012,-0.19%,0,United States,2021,2700,,
SHBI,Shore Bancshares Inc Common Stock,$18.36 ,0.45,2.51%,215784896,United States,,20766,Finance,Major Banks
SHCRW,Sharecare Inc. Warrant,$1.55 ,-0.29,-15.76%,0,United States,2020,325495,Technology,Computer Software: Prepackaged Software
SHEN,Shenandoah Telecommunications Co Common Stock,$31.49 ,-0.56,-1.75%,1573402605,United States,,103511,Public Utilities,Telecommunications Equipment
SHIP,Seanergy Maritime Holdings Corp Common Stock,$1.38 ,0,0.00%,211334965,Greece,,6150327,,
SHIPW,Seanergy Maritime Holdings Corp Class A Warrants,$0.06 ,-0.0019,-3.17%,0,Greece,,40095,,
SHIPZ,Seanergy Maritime Holdings Corp Class B Warrant,$0.09 ,0.0009,1.01%,0,Greece,,5459,Transportation,Marine Transportation
SHQA,Shelter Acquisition Corporation I Class A Common Stock,$9.75 ,-0.005,-0.05%,272029180,United States,2021,1004,,
SHQAU,Shelter Acquisition Corporation I Units,$9.94 ,-0.0531,-0.53%,0,United States,2021,737,,
SHQAW,Shelter Acquisition Corporation I Warrants,$0.50 ,-0.01,-1.96%,0,United States,2021,31703,,
SHYF,The Shyft Group Inc. Common Stock,$40.49 ,-0.46,-1.12%,1431332230,United States,,86041,Capital Goods,Auto Manufacturing
SIBN,SI-BONE Inc. Common Stock,$21.62 ,-0.3,-1.37%,719319452,United States,2018,329419,Health Care,Biotechnology: Electromedical & Electrotherapeutic Apparatus
SIC,Select Interior Concepts Inc. Class A Common Stock,$14.45 ,0.01,0.07%,366568048,United States,,103973,Capital Goods,Homebuilding
SIEB,Siebert Financial Corp. Common Stock,$3.32 ,0.05,1.53%,103860768,United States,,35634,Finance,Investment Bankers/Brokers/Service
SIEN,Sientra Inc. Common Stock,$5.68 ,-0.15,-2.57%,329422994,United States,2014,342063,Health Care,Medical Electronics
SIERU,Sierra Lake Acquisition Corp. Unit,$9.98 ,0.05,0.50%,0,United States,2021,5211,,
SIFY,Sify Technologies Limited American Depositary Shares,$3.27 ,-0.04,-1.21%,595918486,India,,65761,Consumer Services,Telecommunications Equipment
