Symbol,Name,Last Sale,Net Change,% Change,Market Cap,Country,IPO Year,Volume,Sector,Industry
ITRN,Ituran Location and Control Ltd. Ordinary Shares,$27.48 ,2.63,10.58%,571949649,Israel,2005,896502,Technology,Electronic Components
IVA,Inventiva S.A. American Depository Shares,$12.83 ,0.08,0.63%,522728777,France,2020,2631,Consumer Services,Other Consumer Services
IVAC,Intevac Inc. Common Stock,$4.70 ,-0.03,-0.63%,115554125,United States,1995,23373,,
IXAQU,IX Acquisition Corp. Unit,$9.88 ,0,0.00%,0,United Kingdom,2021,161889,,
IZEA,IZEA Worldwide Inc. Common Stock,$1.92 ,-0.02,-1.03%,118779448,United States,,248299,Technology,Advertising
JAGX,Jaguar Health Inc. Common Stock,$2.08 ,0.03,1.46%,95862171,United States,2015,915837,Health Care,Biotechnology: Pharmaceutical Preparations
JAKK,JAKKS Pacific Inc. Common Stock,$11.98 ,0.42,3.63%,118316876,United States,1996,220812,Consumer Non-Durables,Recreational Products/Toys
JAN,JanOne Inc. Common Stock (NV),$5.91 ,-0.315,-5.06%,16709993,United States,,271103,Public Utilities,Environmental Services
JANX,Janux Therapeutics Inc. Common Stock,$21.31 ,-0.11,-0.51%,886741278,United States,2021,146532,Health Care,Biotechnology: Pharmaceutical Preparations
JAQC,Jupiter Acquisition Corporation Common stock,$9.69 ,0.005,0.05%,196683250,United States,2021,4805,,
JAQCU,Jupiter Acquisition Corporation Units,$9.90 ,0.0032,0.03%,0,United States,2021,3202,,
JAQCW,Jupiter Acquisition Corporation Warrants,$0.51 ,0.078,18.06%,0,United States,2021,884,,
JBSS,John B. Sanfilippo & Son Inc. Common Stock,$82.85 ,0.1,0.12%,950248572,United States,1991,22262,Consumer Non-Durables,Specialty Foods
JCIC,Jack Creek Investment Corp. Class A Ordinary Shares,$9.75 ,-0.025,-0.26%,420253125,United States,2021,6267,Finance,Business Services
JCICU,Jack Creek Investment Corp. Units,$10.02 ,-0.005,-0.05%,0,United States,2021,2750,Finance,Business Services
JCICW,Jack Creek Investment Corp. Warrants,$0.60 ,0.01,1.70%,0,United States,2021,30260,Finance,Business Services
JCS,Communications Systems Inc. Common Stock,$8.18 ,0.02,0.25%,79491710,United States,,64522,Public Utilities,Telecommunications Equipment
JCTCF,Jewett-Cameron Trading Company Common Shares,$11.60 ,0.025,0.22%,40474268,United States,,2336,,
JFIN,Jiayin Group Inc. American Depositary Shares,$3.93 ,0.01,0.26%,212318250,China,2019,53103,Finance,Finance: Consumer Services
JFU,9F Inc. American Depositary Shares,$1.75 ,0.02,1.16%,356143692,China,2019,96899,Finance,Finance: Consumer Services
JG,Aurora Mobile Limited American Depositary Shares,$1.63 ,0.01,0.62%,192198803,China,2018,233841,Technology,EDP Services
JMACU,Maxpro Capital Acquisition Corp. Units,$10.11 ,0.11,1.10%,0,Taiwan,,5446098,,
JMPNZ,JMP Group LLC 6.875% Senior Notes due 2029,$25.20 ,0.01,0.04%,0,United States,,2080,Finance,Investment Bankers/Brokers/Service
JNCE,Jounce Therapeutics Inc. Common Stock,$7.68 ,-0.11,-1.41%,393461983,United States,2017,169979,Health Care,Biotechnology: Pharmaceutical Preparations
JOAN,JOANN Inc. Common Stock,$10.51 ,-0.23,-2.14%,443100538,United States,2021,439174,Consumer Non-Durables,Department/Specialty Retail Stores
JOFF,JOFF Fintech Acquisition Corp. Class A Common Stock,$9.79 ,0.01,0.10%,506632500,United States,2021,4304,,
JOFFU,JOFF Fintech Acquisition Corp. Unit,$9.93 ,-0.05,-0.50%,0,United States,2021,1600,,
JOFFW,JOFF Fintech Acquisition Corp. Warrant,$0.69 ,-0.0102,-1.46%,0,United States,2021,734,,
JOUT,Johnson Outdoors Inc. Class A Common Stock,$109.90 ,-1.69,-1.51%,1112979280,United States,,10935,Consumer Non-Durables,Recreational Products/Toys
JRJC,China Finance Online Co. Limited American Depositary Shares,$5.61 ,-0.04,-0.71%,13699396,China,2004,56810,Finance,Investment Bankers/Brokers/Service
JRSH,Jerash Holdings (US) Inc. Common Stock,$7.47 ,0.22,3.03%,92137355,United States,2018,26916,Basic Industries,Industrial Specialties
JRVR,James River Group Holdings Ltd. Common Shares,$38.20 ,-0.11,-0.29%,1423956990,Bermuda,2014,170771,Finance,Property-Casualty Insurers
JSM,Navient Corporation 6% Senior Notes due December 15 2043,$24.88 ,0.07,0.28%,0,United States,,22558,Finance,Finance: Consumer Services
JSPR,Jasper Therapeutics Inc. Common Stock,$7.96 ,-0.36,-4.33%,290701492,United States,2020,706639,Health Care,Biotechnology: Pharmaceutical Preparations
JSPRW,Japer Therapeutics Inc. Warrants,$1.46 ,-0.05,-3.31%,0,United States,2020,7218,Health Care,Biotechnology: Pharmaceutical Preparations
JUGG,Jaws Juggernaut Acquisition Corporation Class A Ordinary Share,$9.69 ,-0.1099,-1.12%,334308450,United States,2021,142,,
JUGGU,Jaws Juggernaut Acquisition Corporation Unit,$10.13 ,0,0.00%,0,United States,2021,100,,
JUGGW,Jaws Juggernaut Acquisition Corporation Warrant,$1.13 ,-0.07,-5.83%,0,United States,2021,100,,
JUPW,Jupiter Wellness Inc. Common Stock,$1.66 ,-0.03,-1.78%,38059592,United States,2020,1086131,Health Care,Biotechnology: Pharmaceutical Preparations
JUPWW,Jupiter Wellness Inc. Warrant,$0.76 ,-0.0064,-0.83%,0,United States,2020,22371,Health Care,Biotechnology: Pharmaceutical Preparations
JVA,Coffee Holding Co. Inc. Common Stock,$4.55 ,0.02,0.44%,25974125,United States,2005,9862,Consumer Non-Durables,Specialty Foods
JWEL,Jowell Global Ltd. Ordinary Shares,$5.60 ,-0.15,-2.61%,142636782,China,2021,42746,Consumer Services,Other Consumer Services
JYAC,Jiya Acquisition Corp. Class A Common Stock,$9.75 ,-0.02,-0.21%,131109137,United States,2020,905,,
JYNT,The Joint Corp. Common Stock,$80.10 ,-5.43,-6.35%,1151524328,United States,2014,600766,,
JZXN,Jiuzi Holdings Inc. Ordinary Shares,$2.11 ,0.03,1.44%,45210641,China,2021,198987,Consumer Durables,Automotive Aftermarket
KAII,Kismet Acquisition Two Corp. Class A Ordinary Shares,$9.71 ,0.01,0.10%,284017500,United States,2021,52729,Finance,Business Services
KAIIU,Kismet Acquisition Two Corp. Unit,$9.90 ,0.025,0.25%,0,United States,2021,463,Finance,Business Services
KAIIW,Kismet Acquisition Two Corp. Warrant,$0.84 ,0.0805,10.63%,0,United States,2021,3933,Finance,Business Services
KAIR,Kairos Acquisition Corp. Class A Ordinary Shares,$9.80 ,0.01,0.10%,338100000,United States,2021,8997,Finance,Business Services
KAIRU,Kairos Acquisition Corp. Unit,$9.97 ,0.01,0.10%,0,United States,2021,6830,Finance,Business Services
KAIRW,Kairos Acquisition Corp. Warrant,$0.58 ,-0.0112,-1.90%,0,United States,2021,1334,Finance,Business Services
KALA,Kala Pharmaceuticals Inc. Common Stock,$2.33 ,-0.08,-3.32%,130619485,United States,2017,565589,Health Care,Biotechnology: Pharmaceutical Preparations
KALU,Kaiser Aluminum Corporation Common Stock,$109.77 ,-3.09,-2.74%,1740932441,United States,,57534,Basic Industries,Aluminum
KALV,KalVista Pharmaceuticals Inc. Common Stock,$17.40 ,0.01,0.06%,425218868,United Kingdom,2015,133535,Health Care,Biotechnology: Pharmaceutical Preparations
KARO,Karooooo Ltd. Ordinary Shares,$30.51 ,-0.8,-2.56%,944318244,Singapore,2021,556,Technology,Computer Software: Prepackaged Software
KAVL,Kaival Brands Innovations Group Inc. Common Stock,$1.29 ,-0.02,-1.53%,36543361,United States,,305476,Consumer Non-Durables,Farming/Seeds/Milling
KBAL,Kimball International Inc. Class B Common Stock,$11.30 ,-0.07,-0.62%,416374558,United States,,84380,Consumer Durables,Industrial Specialties
KBNT,Kubient Inc. Common Stock,$3.13 ,0.04,1.29%,44611533,United States,2020,27024,Technology,EDP Services
KBNTW,Kubient Inc. Warrant,$0.90 ,0.0199,2.26%,0,United States,2020,101,Technology,EDP Services
KBSF,KBS Fashion Group Limited Common Stock,$3.01 ,-0.01,-0.33%,7799810,China,2013,56201,Consumer Non-Durables,Apparel
KDMN,Kadmon Holdings Inc. Common Stock,$8.86 ,0,0.00%,1561506450,United States,,1060814,Health Care,Biotechnology: Pharmaceutical Preparations
KDNY,Chinook Therapeutics Inc. Common Stock,$12.29 ,-0.01,-0.08%,550588755,United States,2015,171535,Health Care,Biotechnology: Pharmaceutical Preparations
KE,Kimball Electronics Inc. Common Stock,$27.93 ,0.47,1.71%,701068444,United States,,55811,Capital Goods,Industrial Machinery/Components
KELYA,Kelly Services Inc. Class A Common Stock,$19.71 ,0.14,0.72%,776306910,United States,,54776,Technology,Diversified Commercial Services
KELYB,Kelly Services Inc. Class B Common Stock,$19.75 ,0.4,2.07%,777882368,United States,,990,Technology,Diversified Commercial Services
KEQU,Kewaunee Scientific Corporation Common Stock,$13.03 ,0,0.00%,36352045,United States,,263,Capital Goods,Medical Specialities
KERN,Akerna Corp. Common Stock,$2.70 ,-0.08,-2.88%,37958509,United States,2018,707487,Health Care,Managed Health Care
KERNW,Akerna Corp Warrant,$0.49 ,-0.005,-1.01%,0,United States,2018,7451,Health Care,Managed Health Care
KFFB,Kentucky First Federal Bancorp Common Stock,$7.13 ,0.0002,0.00%,58624832,United States,,532,Finance,Savings Institutions
KFRC,Kforce Inc. Common Stock,$67.48 ,0.37,0.55%,1459535649,United States,1995,103314,Technology,Diversified Commercial Services
KIDS,OrthoPediatrics Corp. Common Stock,$59.27 ,-2.29,-3.72%,1165995950,United States,2017,83560,Health Care,Medical/Dental Instruments
KIII,Kismet Acquisition Three Corp. Class A Ordinary Shares,$9.74 ,0,0.00%,354719063,United States,2021,183,Finance,Business Services
KIIIU,Kismet Acquisition Three Corp. Unit,$9.87 ,-0.05,-0.50%,0,United States,2021,869,Finance,Business Services
KIIIW,Kismet Acquisition Three Corp. Warrant,$0.51 ,-0.07,-12.07%,0,United States,2021,200,Finance,Business Services
KINS,Kingstone Companies Inc. Common Stock,$6.56 ,0.01,0.15%,69301801,United States,,29282,Finance,Specialty Insurers
KINZ,KINS Technology Group Inc. Class A Common Stock,$9.97 ,0.02,0.20%,343965000,United States,2021,985,,
KINZU,KINS Technology Group Inc. Unit,$10.20 ,0,0.00%,0,United States,2020,100,,
KINZW,KINS Technology Group Inc. Warrant,$0.64 ,0,0.00%,0,United States,2021,4616,,
KIRK,Kirkland's Inc. COMMONSTOCK,$21.27 ,-0.19,-0.89%,286650111,United States,2002,209240,Miscellaneous,Diversified Commercial Services
KLAQ,KL Acquisition Corp Class A Common Stock,$9.78 ,0.01,0.10%,351468750,United States,2021,622,,
KLAQU,KL Acquisition Corp Unit,$9.94 ,0,0.00%,0,United States,2021,123,,
KLAQW,KL Acquisition Corp Warrant,$0.65 ,-0.028,-4.14%,0,United States,2021,15469,,
KLDO,Kaleido Biosciences Inc. Common Stock,$4.98 ,-0.18,-3.49%,212036094,United States,2019,118613,Health Care,Biotechnology: Biological Products (No Diagnostic Substances)
KLTR,Kaltura Inc. Common Stock,$9.36 ,-0.49,-4.98%,1183941458,United States,2021,154499,Technology,EDP Services
KLXE,KLX Energy Services Holdings Inc. Common Stock,$4.65 ,0.15,3.33%,41291423,United States,,1978511,Energy,Oilfield Services/Equipment
KMDA,Kamada Ltd. Ordinary Shares,$5.28 ,0.06,1.15%,236255522,Israel,2013,17205,Health Care,Biotechnology: Pharmaceutical Preparations
KMPH,KemPharm Inc. Common Stock,$8.77 ,-0.08,-0.90%,308298379,United States,,151233,Health Care,Biotechnology: Pharmaceutical Preparations
KNDI,Kandi Technologies Group Inc Common Stock,$4.41 ,0.03,0.69%,334762677,China,,671832,Capital Goods,Auto Parts:O.E.M.
KNSA,Kiniksa Pharmaceuticals Ltd. Class A Common Stock,$11.19 ,-0.17,-1.50%,766773120,United States,2018,166965,Health Care,Biotechnology: Pharmaceutical Preparations
KNTE,Kinnate Biopharma Inc. Common Stock,$20.94 ,-1.92,-8.40%,914575545,United States,2020,84537,Health Care,Biotechnology: Pharmaceutical Preparations
KOPN,Kopin Corporation Common Stock,$4.85 ,-0.15,-3.00%,443727499,United States,1992,650057,Capital Goods,Industrial Machinery/Components
KOR,Corvus Gold Inc. Common Shares,$3.25 ,0.04,1.25%,412761278,Canada,,75676,,
KOSS,Koss Corporation Common Stock,$15.27 ,-0.43,-2.74%,139135751,United States,,82526,Consumer Non-Durables,Consumer Electronics/Appliances
KPLT,Katapult Holdings Inc. Common Stock,$4.55 ,-0.14,-2.99%,440538348,United States,2019,2504322,Technology,EDP Services
KPLTW,Katapult Holdings Inc. Warrant,$1.20 ,-0.02,-1.64%,0,United States,2019,32489,Technology,EDP Services
KPTI,Karyopharm Therapeutics Inc. Common Stock,$5.70 ,-0.06,-1.04%,430334376,United States,2013,664088,Miscellaneous,Diversified Commercial Services
KRBP,Kiromic BioPharma Inc. Common Stock,$1.94 ,-0.23,-10.60%,29949117,United States,2020,837575,Consumer Durables,Specialty Chemicals
KRKR,36Kr Holdings Inc. American Depositary Shares,$1.55 ,-0.02,-1.27%,59759929,China,2019,102684,Miscellaneous,Business Services
KRMD,Repro Med Systems Inc. Common Stock,$2.79 ,0.04,1.46%,124186142,United States,,43721,Health Care,Medical/Dental Instruments
KRNL,Kernel Group Holdings Inc. Class A Ordinary Shares,$9.75 ,0,0.00%,371414063,United States,2021,4918,Finance,Business Services
KRNLU,Kernel Group Holdings Inc. Units,$10.03 ,0,0.00%,0,United States,2021,15,Finance,Business Services
KRNLW,Kernel Group Holdings Inc. Warrants,$0.60 ,0,0.00%,0,United States,2021,133287,Finance,Business Services
KRNY,Kearny Financial Corp Common Stock,$13.17 ,0.08,0.61%,1010730162,United States,,163551,Finance,Savings Institutions
KRON,Kronos Bio Inc. Common Stock,$17.76 ,-1.86,-9.48%,999074379,United States,2020,151428,Consumer Durables,Specialty Chemicals
KROS,Keros Therapeutics Inc. Common Stock,$36.95 ,-0.27,-0.73%,862334001,United States,2020,79332,Consumer Durables,Specialty Chemicals
KRT,Karat Packaging Inc. Common Stock,$19.23 ,0.37,1.96%,379109835,United States,2021,39285,Capital Goods,Office Equipment/Supplies/Services
KRUS,Kura Sushi USA Inc. Class A Common Stock,$46.14 ,1.74,3.92%,447327208,United States,2019,42687,Consumer Services,Restaurants
KRYS,Krystal Biotech Inc. Common Stock,$51.60 ,-0.38,-0.73%,1145811127,United States,2017,116671,Health Care,Biotechnology: Biological Products (No Diagnostic Substances)
KSI,Kadem Sustainable Impact Corporation Class A common stock,$9.71 ,0,0.00%,212406250,United States,2021,14,,
KSICW,Kadem Sustainable Impact Corporation Warrant,$0.56 ,-0.0073,-1.30%,0,United States,2021,810,,
KSPN,Kaspien Holdings Inc. Common Stock,$14.60 ,-0.3,-2.01%,36391493,United States,,3432,Consumer Services,Consumer Electronics/Video Chains
KTCC,Key Tronic Corporation Common Stock,$6.50 ,0.02,0.31%,69952162,United States,1983,9693,Technology,Computer peripheral equipment
KTRA,Kintara Therapeutics Inc. Common Stock,$0.77 ,-0.0344,-4.30%,33054772,United States,,906070,Health Care,Biotechnology: Pharmaceutical Preparations
KTTA,Pasithea Therapeutics Corp. Common Stock,$2.62 ,-0.04,-1.50%,34212932,United States,2021,55930,Health Care,Biotechnology: Pharmaceutical Preparations
KTTAW,Pasithea Therapeutics Corp. Warrant,$0.50 ,0.01,2.04%,0,United States,2021,100,Health Care,Biotechnology: Pharmaceutical Preparations
KURA,Kura Oncology Inc. Common Stock,$18.71 ,-0.25,-1.32%,1240388955,United States,,405517,Health Care,Biotechnology: Biological Products (No Diagnostic Substances)
KURI,Alkuri Global Acquisition Corp. Class A common stock,$9.98 ,0,0.00%,430387500,United States,2021,745180,,
KURIU,Alkuri Global Acquisition Corp. Unit,$10.28 ,0.065,0.64%,0,United States,2021,50097,,
KURIW,Alkuri Global Acquisition Corp. Warrant,$1.37 ,0.04,3.01%,0,United States,2021,14982,,
KVHI,KVH Industries Inc. Common Stock,$9.91 ,0.07,0.71%,186407199,United States,1996,64160,Technology,Radio And Television Broadcasting And Communications Equipment
KVSA,Khosla Ventures Acquisition Co. Class A Common Stock,$9.91 ,0.0006,0.01%,401255900,United States,2021,4443,,
KVSB,Khosla Ventures Acquisition Co. II Class A Common Stock,$10.02 ,-0.01,-0.10%,478626342,United States,2021,168086,,
KVSC,Khosla Ventures Acquisition Co. III Class A Common Stock,$9.82 ,0,0.00%,651362780,United States,2021,3534,,
KXIN,Kaixin Auto Holdings Ordinary Share,$2.32 ,-0.04,-1.70%,332828348,China,2017,1710260,Finance,Business Services
KZIA,Kazia Therapeutics Limited American Depositary Shares,$10.79 ,0.1,0.94%,142441164,Australia,,5751,Health Care,Biotechnology: Pharmaceutical Preparations
KZR,Kezar Life Sciences Inc. Common Stock,$8.31 ,-0.36,-4.15%,400482500,United States,2018,70915,Health Care,Biotechnology: Pharmaceutical Preparations
LAAA,Lakeshore Acquisition I Corp. Ordinary Shares,$9.84 ,0.03,0.31%,69818982,China,2021,401,,
LAAAU,Lakeshore Acquisition I Corp. Unit,$10.15 ,-0.015,-0.15%,0,China,2021,300,,
LAAAW,Lakeshore Acquisition I Corp. Warrant,$0.53 ,0.0314,6.30%,0,China,2021,300,,
LABP,Landos Biopharma Inc. Common Stock,$14.50 ,-0.12,-0.82%,581705171,United States,2021,7230,Consumer Durables,Specialty Chemicals
LAKE,Lakeland Industries Inc. Common Stock,$21.20 ,0.43,2.07%,165480331,United States,1986,53269,,
LAND,Gladstone Land Corporation Common Stock,$22.76 ,-0.19,-0.83%,713010463,United States,2013,102412,Consumer Services,Real Estate Investment Trusts
LANDM,Gladstone Land Corporation 5.00% Series D Cumulative Term Preferred Stock,$26.00 ,-0.0001,0.00%,626660146,United States,,757,Consumer Services,Real Estate Investment Trusts
LANDO,Gladstone Land Corporation 6.00% Series B Cumulative Redeemable Preferred Stock,$25.60 ,0.0574,0.23%,0,United States,,22359,Consumer Services,Real Estate Investment Trusts
LARK,Landmark Bancorp Inc. Common Stock,$27.75 ,-0.13,-0.47%,132075681,United States,,453,Finance,Major Banks
LASR,nLIGHT Inc. Common Stock,$25.64 ,-0.21,-0.81%,1107600387,United States,2018,116332,Technology,Semiconductors
LAWS,Lawson Products Inc. Common Stock,$51.55 ,0.51,1.00%,467988788,United States,,5841,Capital Goods,Industrial Machinery/Components
LAZY,Lazydays Holdings Inc. Common Stock,$21.31 ,-0.03,-0.14%,241436866,United States,,88636,Consumer Services,Other Specialty Stores
LBAI,Lakeland Bancorp Inc. Common Stock,$18.21 ,-0.04,-0.22%,921450565,United States,,41607,Finance,Major Banks
LBC,Luther Burbank Corporation Common Stock,$13.47 ,0.07,0.52%,696714831,United States,2017,5294,Finance,Commercial Banks
LBPH,Longboard Pharmaceuticals Inc. Common Stock,$9.04 ,0.02,0.22%,155626764,United States,2021,12672,Health Care,Biotechnology: Pharmaceutical Preparations
LBPS,4D pharma plc American Depositary Shares,$7.07 ,0.51,7.77%,159340973,United Kingdom,,63880,Health Care,Biotechnology: Pharmaceutical Preparations
LBPSW,4D pharma plc Warrant,$0.70 ,-0.02,-2.78%,0,United Kingdom,,9452,Health Care,Biotechnology: Pharmaceutical Preparations
LBRDP,Liberty Broadband Corporation Series A Cumulative Redeemable Preferred Stock,$27.77 ,-0.11,-0.40%,0,United States,,3262,Consumer Services,Television Services
LCA,Landcadia Holdings IV Inc. Class A Common Stock,$9.76 ,0.015,0.15%,610000000,United States,2021,716,,
LCAA,L Catterton Asia Acquisition Corp Class A Ordinary Shares,$9.75 ,0,0.00%,349182522,Singapore,2021,3720,Finance,Business Services
LCAAU,L Catterton Asia Acquisition Corp Units,$9.96 ,0,0.00%,0,Singapore,2021,1,Finance,Business Services
LCAAW,L Catterton Asia Acquisition Corp Warrant,$0.74 ,0,0.00%,0,Singapore,2021,12,Finance,Business Services
LCAHU,Landcadia Holdings IV Inc. Units,$10.00 ,0.01,0.10%,0,United States,2021,1641,,
LCAHW,Landcadia Holdings IV Inc. Warrant ,$1.00 ,-0.05,-4.76%,0,United States,2021,1809,,
LCAP,Lionheart Acquisition Corp. II Class A Common Stock,$9.91 ,-0.015,-0.15%,291354000,United States,2020,5978,,
LCAPU,Lionheart Acquisition Corp. II Unit,$10.30 ,0.03,0.29%,0,United States,2020,1400,,
LCAPW,Lionheart Acquisition Corp. II Warrant,$0.80 ,0,0.00%,0,United States,2020,7594,,
LCIDW,Lucid Group Inc. Warrant,$10.31 ,-0.52,-4.80%,0,United States,,258737,Capital Goods,Auto Manufacturing
LCNB,LCNB Corporation Common Stock,$17.72 ,0.04,0.23%,221506503,United States,,15037,Finance,Major Banks
LCUT,Lifetime Brands Inc. Common Stock,$17.79 ,-0.13,-0.73%,391497823,United States,1991,33038,Consumer Durables,Home Furnishings
LDHA,LDH Growth Corp I Class A Ordinary Shares,$9.77 ,0.03,0.31%,280887500,United States,2021,4764,Finance,Business Services
LDHAU,LDH Growth Corp I Units,$9.84 ,-0.03,-0.30%,0,United States,2021,473,Finance,Business Services
LDHAW,LDH Growth Corp I Warrant,$0.79 ,-0.0001,-0.01%,0,United States,2021,66,Finance,Business Services
LE,Lands' End Inc. Common Stock,$22.74 ,-0.51,-2.19%,749988554,United States,,124052,Consumer Services,Clothing/Shoe/Accessory Stores
LEDS,SemiLEDS Corporation Common Stock,$7.65 ,-0.03,-0.39%,33998734,Taiwan,2010,120396,Technology,Semiconductors
LEE,Lee Enterprises Incorporated Common Stock,$21.46 ,-0.415,-1.90%,126377575,United States,,9945,Consumer Services,Newspapers/Magazines
LEGA,Lead Edge Growth Opportunities Ltd Class A Ordinary Shares,$9.82 ,0.01,0.10%,291565915,United States,2021,24889,Finance,Business Services
LEGAU,Lead Edge Growth Opportunities Ltd Units,$9.98 ,0,0.00%,0,United States,2021,2772,Finance,Business Services
LEGAW,Lead Edge Growth Opportunities Ltd Warrant,$0.70 ,-0.01,-1.41%,0,United States,2021,886,Finance,Business Services
LEGH,Legacy Housing Corporation Common Stock (TX),$17.36 ,0.28,1.64%,420157674,United States,2018,32919,Basic Industries,Homebuilding
LEGO,Legato Merger Corp. Common stock,$10.63 ,0.12,1.14%,322163793,United States,2021,797495,,
LEGOU,Legato Merger Corp. Units,$13.20 ,0.05,0.38%,0,United States,2021,1861,,
LEGOW,Legato Merger Corp. Warrant,$2.71 ,0.08,3.04%,0,United States,2021,58405,,
LEVL,Level One Bancorp Inc. Common Stock,$29.53 ,-0.73,-2.41%,225716807,United States,2018,2405,,
LEVLP,Level One Bancorp Inc. Depositary Shares Each Representing a 1/100th Interest in a Share of 7.50% Non-Cumulative Perpetual Preferred Stock Series B,$27.70 ,0.1993,0.73%,0,United States,,210,,
LEXX,Lexaria Bioscience Corp. Common Stock,$6.58 ,0.09,1.39%,37681679,Canada,,70057,Health Care,Biotechnology: Pharmaceutical Preparations
LEXXW,Lexaria Bioscience Corp. Warrant,$2.05 ,0.16,8.47%,0,Canada,,4736,Health Care,Biotechnology: Pharmaceutical Preparations
LFMD,LifeMD Inc. Common Stock,$5.08 ,-0.7,-12.11%,155413807,United States,,651717,Miscellaneous,Diversified Commercial Services
LFMDP,LifeMD Inc. 8.875% Series A Cumulative Perpetual Preferred Stock,$24.27 ,0.07,0.29%,0,United States,,7801,Miscellaneous,Diversified Commercial Services
LFTR,Lefteris Acquisition Corp. Class A Common Stock,$9.77 ,-0.0101,-0.10%,252919576,United States,2020,5739,,
LFTRU,Lefteris Acquisition Corp. Unit,$10.04 ,-0.14,-1.38%,0,United States,2020,670,,
LFTRW,Lefteris Acquisition Corp. Warrant,$0.85 ,-0.0095,-1.11%,0,United States,2020,12669,,
LFVN,Lifevantage Corporation Common Stock (Delaware),$6.86 ,0.07,1.03%,90798576,United States,,37250,Consumer Non-Durables,Farming/Seeds/Milling
LGAC,Lazard Growth Acquisition Corp. I Ordinary Shares,$9.75 ,0.02,0.21%,700781250,,2021,395850,Finance,Business Services
LGACU,Lazard Growth Acquisition Corp. I Units,$9.89 ,0,0.00%,0,,2021,5907,Finance,Business Services
LGACW,Lazard Growth Acquisition Corp. I Warrants,$0.85 ,0,0.00%,0,,2021,52000,Finance,Business Services
LGHL,Lion Group Holding Ltd. American Depositary Share,$2.27 ,0.05,2.25%,88918797,China,,1568639,Finance,Investment Bankers/Brokers/Service
LGHLW,Lion Group Holding Ltd. Warrant,$0.18 ,0.007,4.00%,0,China,,53019,Finance,Investment Bankers/Brokers/Service
LGO,Largo Resources Ltd. Common Shares,$10.13 ,0.24,2.43%,655178010,Canada,,87294,,
LGVN,Longeveron Inc. Class A Common Stock,$3.42 ,0.07,2.09%,65372035,United States,2021,30635,Consumer Durables,Specialty Chemicals
LHAA,Lerer Hippeau Acquisition Corp. Class A Common Stock,$9.79 ,-0.01,-0.10%,279191758,United States,2021,133,,
LHDX,Lucira Health Inc. Common Stock,$6.13 ,-0.47,-7.12%,237223577,United States,2021,368477,Health Care,Biotechnology: Electromedical & Electrotherapeutic Apparatus
LIDR,AEye Inc. Class A Common Stock,$4.42 ,-0.13,-2.86%,682467015,United States,2021,861174,Capital Goods,Auto Parts:O.E.M.
LIDRW,AEye Inc. Warrant,$0.84 ,0.0634,8.13%,0,United States,2021,17192,Capital Goods,Auto Parts:O.E.M.
LIFE,aTyr Pharma Inc. Common Stock,$8.89 ,0.38,4.47%,246262975,United States,2015,2055332,Health Care,Biotechnology: Biological Products (No Diagnostic Substances)
LILMW,Lilium N.V. Warrants,$2.38 ,0.52,27.96%,0,Germany,,404614,,
LINC,Lincoln Educational Services Corporation Common Stock,$6.91 ,-0.05,-0.72%,186377660,United States,2005,47237,Miscellaneous,Service to the Health Industry
LIND,Lindblad Expeditions Holdings Inc. Common Stock,$15.20 ,0.01,0.07%,761088670,United States,2013,118647,,
LINK,Interlink Electronics Inc. Common Stock,$8.96 ,0.1621,1.84%,59172247,United States,,1519,Capital Goods,Industrial Machinery/Components
LIQT,LiqTech International Inc. Common Stock,$6.06 ,0.21,3.59%,131970880,Denmark,,101055,Capital Goods,Industrial Machinery/Components
LITT,Logistics Innovation Technologies Corp. Class A Common Stock,$9.80 ,0,0.00%,417597737,United States,2021,4,,
LITTW,Logistics Innovation Technologies Corp. Warrant,$0.81 ,0,0.00%,0,United States,2021,164,,
LIVE,Live Ventures Incorporated Common Stock,$36.14 ,0.0898,0.25%,56769627,United States,,7215,Capital Goods,Recreational Products/Toys
LIXT,Lixte Biotechnology Holdings Inc. Common Stock,$1.80 ,-0.0588,-3.16%,24743867,United States,,15919,Health Care,Biotechnology: Pharmaceutical Preparations
LIXTW,Lixte Biotechnology Holdings Inc. Warrants,$0.51 ,0,0.00%,0,United States,,18,Health Care,Biotechnology: Pharmaceutical Preparations
LIZI,LIZHI INC. American Depositary Shares,$3.10 ,-0.03,-0.96%,155864289,China,2020,320135,Technology,Computer Software: Programming Data Processing
LJAQ,LightJump Acquisition Corporation Common Stock,$9.86 ,0.03,0.31%,171268200,United States,2021,608,,
LJAQU,LightJump Acquisition Corporation Unit,$10.10 ,0.05,0.50%,0,United States,2021,1881,,
LJAQW,LightJump Acquisition Corporation Warrant,$0.54 ,-0.0001,-0.02%,0,United States,2021,439,,
LJPC,La Jolla Pharmaceutical Company Common Stock,$4.01 ,-0.02,-0.50%,110227429,United States,1994,63583,Health Care,Biotechnology: Biological Products (No Diagnostic Substances)
LKCO,Luokung Technology Corp Ordinary Shares,$1.11 ,-0.04,-3.48%,424466469,China,,3575685,Consumer Services,Telecommunications Equipment
