Symbol,Name,Last Sale,Net Change,% Change,Market Cap,Country,IPO Year,Volume,Sector,Industry
CPTAG,Capitala Finance Corp. 5.75% Convertible Notes Due 2022,$25.35 ,0,0.00%,0,United States,,319,Finance,Trusts Except Educational Religious and Charitable
CPTAL,Capitala Finance Corp. 6% Notes Due 2022,$25.39 ,-0.002,-0.01%,0,United States,,500,Finance,Trusts Except Educational Religious and Charitable
CPZ,Calamos Long/Short Equity & Dynamic Income Trust Common Stock,$20.67 ,0.1687,0.82%,405797450,United States,2019,38236,Finance,Trusts Except Educational Religious and Charitable
CRAI,CRA International Inc. Common Stock,$107.22 ,-0.02,-0.02%,791474559,United States,1998,43435,Miscellaneous,Other Consumer Services
CRBP,Corbus Pharmaceuticals Holdings Inc. Common Stock,$1.03 ,-0.05,-4.63%,128987807,United States,,669385,Health Care,Biotechnology: Pharmaceutical Preparations
CRBU,Caribou Biosciences Inc. Common Stock,$19.16 ,-3.44,-15.22%,1149041352,United States,2021,1207144,Consumer Durables,Specialty Chemicals
CRDF,Cardiff Oncology Inc. Common Stock,$6.57 ,-0.03,-0.46%,259857488,United States,,291588,Health Care,Biotechnology: Biological Products (No Diagnostic Substances)
CRDL,Cardiol Therapeutics Inc. Class A Common Shares,$3.27 ,-0.13,-3.82%,140435362,Canada,,346212,,
CREG,China Recycling Energy Corporation Common Stock,$5.97 ,0.21,3.65%,39302462,China,,69984,,
CRESW,Cresud S.A.C.I.F. y A. Warrant,$0.20 ,0.0051,2.62%,0,Argentina,,3000,Finance,Real Estate
CRESY,Cresud S.A.C.I.F. y A. American Depositary Shares,$5.04 ,0.04,0.80%,297061874,Argentina,1997,56773,Finance,Real Estate
CREX,Creative Realities Inc. Common Stock,$1.40 ,0.01,0.72%,16655793,United States,,52160,Technology,EDP Services
CREXW,Creative Realities Inc. Warrant,$0.19 ,0.0443,29.49%,0,United States,,9656,Technology,EDP Services
CRIS,Curis Inc. Common Stock,$7.53 ,-0.14,-1.83%,689720659,United States,,517297,Health Care,Biotechnology: Biological Products (No Diagnostic Substances)
CRKN,Crown Electrokinetics Corp. Common Stock,$4.04 ,-0.19,-4.49%,60751128,United States,,76296,,
CRMD,CorMedix Inc. Common Stock,$4.87 ,0.03,0.62%,185480948,United States,,127065,Health Care,Biotechnology: Pharmaceutical Preparations
CRMT,America's Car-Mart Inc Common Stock,$117.63 ,-1.12,-0.94%,768944722,United States,,26232,Consumer Services,Other Specialty Stores
CRNT,Ceragon Networks Ltd. Ordinary Shares,$3.35 ,-0.07,-2.05%,279660050,Israel,,249106,Technology,Radio And Television Broadcasting And Communications Equipment
CRNX,Crinetics Pharmaceuticals Inc. Common Stock,$19.50 ,-0.22,-1.12%,768591837,United States,2018,109102,Health Care,Biotechnology: Pharmaceutical Preparations
CRTD,Creatd Inc. Common Stock,$2.25 ,-0.08,-3.43%,30652997,United States,,384152,Consumer Services,Publishing
CRTDW,Creatd Inc. Warrant,$0.45 ,-0.098,-17.82%,0,United States,,5211,Consumer Services,Publishing
CRVS,Corvus Pharmaceuticals Inc. Common Stock,$4.70 ,-0.17,-3.49%,199379447,United States,2016,1084713,Health Care,Biotechnology: Pharmaceutical Preparations
CRWS,Crown Crafts Inc Common Stock,$7.40 ,-0.0001,0.00%,74242509,United States,,1216,Basic Industries,Textiles
CRXT,Clarus Therapeutics Holdings Inc. Common Stock,$3.82 ,0.17,4.66%,27675900,United States,2021,448126,Health Care,Biotechnology: Pharmaceutical Preparations
CRXTW,Clarus Therapeutics Holdings Inc. Warrants,$0.58 ,-0.0001,-0.02%,0,United States,2021,11855,Health Care,Biotechnology: Pharmaceutical Preparations
CRZN,Corazon Capital V838 Monoceros Corp Class A Ordinary Shares,$9.76 ,0.01,0.10%,248634780,United States,2021,13957,Finance,Business Services
CRZNU,Corazon Capital V838 Monoceros Corp Unit,$9.95 ,-0.0075,-0.08%,0,United States,2021,1000,Finance,Business Services
CRZNW,Corazon Capital V838 Monoceros Corp Warrant,$0.73 ,-0.1493,-17.03%,0,United States,2021,4551,Finance,Business Services
CSBR,Champions Oncology Inc. Common Stock,$10.17 ,0.015,0.15%,136435707,United States,,1670,Health Care,Biotechnology: Biological Products (No Diagnostic Substances)
CSCW,Color Star Technology Co. Ltd. Ordinary Shares,$0.51 ,-0.0056,-1.09%,58235519,United States,,2270513,,
CSGS,CSG Systems International Inc. Common Stock,$51.05 ,0.01,0.02%,1671508403,United States,1996,46488,Technology,EDP Services
CSII,Cardiovascular Systems Inc. Common Stock,$32.40 ,-0.8,-2.41%,1314832014,United States,1981,145090,Health Care,Medical/Dental Instruments
CSIQ,Canadian Solar Inc. Common Shares (BC),$33.03 ,0.96,2.99%,1981722148,China,2006,967616,,
CSPI,CSP Inc. Common Stock,$8.91 ,0.35,4.09%,39003222,United States,1982,1812,Technology,EDP Services
CSSE,Chicken Soup for the Soul Entertainment Inc. Class A Common Stock,$21.33 ,-0.49,-2.25%,269800994,United States,2017,75055,Consumer Services,Broadcasting
CSSEN,Chicken Soup for the Soul Entertainment Inc. 9.50% Notes due 2025,$25.94 ,0.04,0.15%,0,United States,,1000,Consumer Services,Movies/Entertainment
CSSEP,Chicken Soup for the Soul Entertainment Inc. 9.75% Series A Cumulative Redeemable Perpetual Preferred Stock,$27.43 ,-0.23,-0.83%,0,United States,,4186,Consumer Services,Broadcasting
CSTE,Caesarstone Ltd. Ordinary Shares,$12.39 ,-0.17,-1.35%,426727967,Israel,2012,65413,Capital Goods,Building Materials
CSTL,Castle Biosciences Inc. Common Stock,$61.30 ,-3.76,-5.78%,1542759475,United States,2019,124640,Health Care,Medical Specialities
CSTR,CapStar Financial Holdings Inc. Common Stock,$21.75 ,-0.05,-0.23%,482050905,United States,2016,28254,Finance,Major Banks
CSWC,Capital Southwest Corporation Common Stock,$26.30 ,0.29,1.12%,583858738,United States,,57169,Finance,Finance/Investors Services
CTAQ,Carney Technology Acquisition Corp. II Class A Common Stock,$9.78 ,-0.01,-0.10%,500858250,United States,2021,5433,,
CTAQU,Carney Technology Acquisition Corp. II Units,$9.96 ,-0.01,-0.10%,0,United States,2020,5399,,
CTAQW,Carney Technology Acquisition Corp. II Warrant,$0.67 ,0.015,2.29%,0,United States,2021,9146,,
CTBI,Community Trust Bancorp Inc. Common Stock,$43.59 ,0.26,0.60%,777528474,United States,,19586,Finance,Major Banks
CTG,Computer Task Group Inc. Common Stock,$7.94 ,0.04,0.51%,121704558,United States,,10601,Technology,EDP Services
CTHR,Charles & Colvard Ltd Common Stock,$2.90 ,-0.02,-0.69%,87984425,United States,1997,59946,Consumer Non-Durables,Consumer Specialties
CTIB,Yunhong CTI Ltd. Common Stock,$2.00 ,-0.01,-0.50%,11773500,United States,1997,13697,Miscellaneous,Diversified Commercial Services
CTIC,CTI BioPharma Corp. (DE) Common Stock,$2.68 ,-0.07,-2.55%,250070594,United States,1997,498625,Health Care,Biotechnology: Pharmaceutical Preparations
CTLP,Cantaloupe Inc. Common Stock,$10.98 ,-0.31,-2.75%,778876028,United States,,79013,Technology,EDP Services
CTMX,CytomX Therapeutics Inc. Common Stock,$4.83 ,-0.04,-0.82%,314708324,United States,2015,335106,Health Care,Biotechnology: Pharmaceutical Preparations
CTRE,CareTrust REIT Inc. Common Stock,$20.43 ,0.17,0.84%,1982427011,United States,,406953,Consumer Services,Real Estate Investment Trusts
CTRM,Castor Maritime Inc. Common Shares,$2.30 ,-0.05,-2.13%,215094287,Cyprus,,1888265,Transportation,Marine Transportation
CTRN,Citi Trends Inc. Common Stock,$74.18 ,-2.34,-3.06%,673309383,United States,2005,170303,,
CTSO,Cytosorbents Corporation Common Stock,$7.13 ,-0.065,-0.90%,307715677,United States,,208607,Health Care,Medical/Dental Instruments
CTXR,Citius Pharmaceuticals Inc. Common Stock,$2.04 ,-0.06,-2.86%,297798035,United States,,1382183,Health Care,Biotechnology: Pharmaceutical Preparations
CTXRW,Citius Pharmaceuticals Inc. Warrant,$0.71 ,-0.0902,-11.28%,0,United States,,1653,Health Care,Biotechnology: Pharmaceutical Preparations
CUBA,Herzfeld Caribbean Basin Fund Inc. (The) Common Stock,$5.88 ,-0.02,-0.34%,34262654,United States,,16337,Finance,Investment Managers
CUE,Cue Biopharma Inc. Common Stock,$13.15 ,-0.1,-0.76%,414334684,United States,2018,102087,Health Care,Biotechnology: Pharmaceutical Preparations
CUEN,Cuentas Inc. Common Stock,$2.69 ,0.07,2.67%,40069406,United States,,99048,Technology,Computer Software: Prepackaged Software
CUENW,Cuentas Inc. Warrant,$1.00 ,-0.05,-4.76%,0,United States,,3500,Technology,Computer Software: Prepackaged Software
CULL,Cullman Bancorp Inc. Common Stock,$13.19 ,0.08,0.61%,97683729,United States,2021,7510,Finance,Savings Institutions
CURI,CuriosityStream Inc. Class A Common Stock,$10.11 ,-0.51,-4.80%,531734227,United States,2020,372252,Consumer Services,Broadcasting
CURIW,CuriosityStream Inc. Warrant,$3.03 ,-0.17,-5.31%,0,United States,2020,5680,Consumer Services,Broadcasting
CUTR,Cutera Inc. Common Stock,$43.75 ,-0.83,-1.86%,784982013,United States,2004,96635,Health Care,Biotechnology: Electromedical & Electrotherapeutic Apparatus
CVCY,Central Valley Community Bancorp Common Stock,$21.24 ,-0.06,-0.28%,254544705,United States,,39404,Finance,Major Banks
CVGI,Commercial Vehicle Group Inc. Common Stock,$10.05 ,0.04,0.40%,331420800,United States,2004,252645,Capital Goods,Auto Parts:O.E.M.
CVGW,Calavo Growers Inc. Common Stock,$37.16 ,-1.34,-3.48%,657111762,United States,,137539,,Farming/Seeds/Milling
CVLG,Covenant Logistics Group Inc. Class A Common Stock,$28.01 ,0.05,0.18%,470670937,United States,,50896,Transportation,Trucking Freight/Courier Services
CVLY,Codorus Valley Bancorp Inc Common Stock,$23.06 ,0.26,1.14%,224879344,United States,,6353,Finance,Savings Institutions
CVRX,CVRx Inc. Common Stock,$16.52 ,-0.04,-0.24%,336114698,United States,2021,63717,Health Care,Biotechnology: Electromedical & Electrotherapeutic Apparatus
CVV,CVD Equipment Corporation Common Stock,$4.71 ,0.01,0.21%,31482964,United States,,6897,Technology,Industrial Machinery/Components
CWBC,Community West Bancshares Common Stock,$13.01 ,-0.04,-0.31%,111745050,United States,,5568,Finance,Major Banks
CWBR,CohBar Inc. Common Stock,$0.96 ,-0.0089,-0.92%,61864840,United States,,564228,Health Care,Biotechnology: In Vitro & In Vivo Diagnostic Substances
CWCO,Consolidated Water Co. Ltd. Ordinary Shares,$11.87 ,0.4,3.49%,180550997,Cayman Islands,,61949,Public Utilities,Water Supply
CXDC,China XD Plastics Company Limited Common Stock,$0.42 ,0.0023,0.55%,29792776,China,,194159,Consumer Non-Durables,Plastic Products
CXDO,Crexendo Inc. Common Stock,$6.00 ,0.13,2.22%,129351864,United States,,28899,Consumer Services,Telecommunications Equipment
CYAD,Celyad Oncology SA American Depositary Shares,$4.06 ,0.13,3.31%,62905461,Belgium,2015,161753,Health Care,Biotechnology: Pharmaceutical Preparations
CYAN,Cyanotech Corporation Common Stock,$2.93 ,-0.04,-1.35%,17943900,United States,,19712,Consumer Non-Durables,Farming/Seeds/Milling
CYBE,CyberOptics Corporation Common Stock,$34.65 ,-0.06,-0.17%,253477952,United States,1987,41324,Capital Goods,Electronic Components
CYCC,Cyclacel Pharmaceuticals Inc. Common Stock,$5.30 ,-0.04,-0.75%,48940783,United States,,39302,Health Care,Biotechnology: Pharmaceutical Preparations
CYCCP,Cyclacel Pharmaceuticals Inc. 6% Convertible Preferred Stock,$8.03 ,0.05,0.63%,0,United States,,202,Health Care,Biotechnology: Pharmaceutical Preparations
CYCN,Cyclerion Therapeutics Inc. Common Stock,$2.85 ,-0.05,-1.72%,123338735,United States,,152670,Health Care,Biotechnology: Pharmaceutical Preparations
CYRN,CYREN Ltd. Ordinary Shares,$0.51 ,-0.039,-7.14%,45525042,United States,,4322269,Technology,Computer Software: Prepackaged Software
CYT,Cyteir Therapeutics Inc. Common Stock,$16.96 ,-0.54,-3.09%,599870553,United States,2021,49538,Health Care,Biotechnology: Pharmaceutical Preparations
CYTH,Cyclo Therapeutics Inc. Common Stock,$6.59 ,-0.2,-2.95%,42427553,United States,,38336,Health Care,Biotechnology: Pharmaceutical Preparations
CYTO,Altamira Therapeutics Ltd. Common Shares 0.01 SF (Bermuda),$1.74 ,-0.1,-5.44%,12335751,Bermuda,2014,58143,Health Care,Biotechnology: Pharmaceutical Preparations
CYXT,Cyxtera Technologies Inc. Class A Common Stock,$8.69 ,-0.08,-0.91%,1442355251,United States,2020,333050,Technology,EDP Services
CYXTW,Cyxtera Technologies Inc. Warrant,$2.10 ,0.1,5.00%,0,United States,2020,22831,Technology,EDP Services
CZNC,Citizens & Northern Corp Common Stock,$25.92 ,-0.28,-1.07%,410693743,United States,,28533,Finance,Major Banks
CZWI,Citizens Community Bancorp Inc. Common Stock,$13.84 ,0.05,0.36%,147845897,United States,,9337,Finance,Savings Institutions
DAIO,Data I/O Corporation Common Stock,$6.09 ,-0.19,-3.03%,52492889,United States,1981,47124,Capital Goods,Industrial Machinery/Components
DAKT,Daktronics Inc. Common Stock,$5.66 ,0,0.00%,256721944,United States,1994,81560,Capital Goods,Office Equipment/Supplies/Services
DALN,DallasNews Corporation Series A Common Stock,$6.84 ,0.1099,1.63%,36610496,United States,,11063,Consumer Services,Newspapers/Magazines
DALS,DA32 Life Science Tech Acquisition Corp. Class A Common Stock,$9.73 ,-0.06,-0.61%,256872000,United States,2021,20123,,
DARE,Dare Bioscience Inc. Common Stock,$1.58 ,-0.02,-1.25%,111424727,United States,2014,693892,Health Care,Biotechnology: Pharmaceutical Preparations
DATS,DatChat Inc. Common Stock,$11.72 ,3.68,45.77%,202164245,United States,2021,65895455,Technology,Computer Software: Prepackaged Software
DATSW,DatChat Inc. Series A Warrant,$6.69 ,2.31,52.74%,0,United States,2021,244165,Technology,Computer Software: Prepackaged Software
DAWN,Day One Biopharmaceuticals Inc. Common Stock,$22.03 ,0.38,1.76%,1364294526,United States,2021,33495,Health Care,Biotechnology: Pharmaceutical Preparations
DBDR,Roman DBDR Tech Acquisition Corp. Class A Common Stock,$10.13 ,0,0.00%,293212850,United States,2020,804,,
DBDRW,Roman DBDR Tech Acquisition Corp. Warrant,$1.66 ,0.02,1.22%,0,United States,2020,89315,,
DBGI,Digital Brands Group Inc. Common Stock,$2.75 ,0.03,1.10%,34725587,United States,2021,174097,Consumer Non-Durables,Apparel
DBGIW,Digital Brands Group Inc. Warrant,$0.84 ,0.0594,7.61%,0,United States,2021,350,Consumer Non-Durables,Apparel
DBTX,Decibel Therapeutics Inc. Common Stock,$7.63 ,-0.14,-1.80%,189974288,United States,2021,21944,Health Care,Biotechnology: Pharmaceutical Preparations
DBVT,DBV Technologies S.A. American Depositary Shares,$5.02 ,0.34,7.27%,551835417,France,2014,84540,Health Care,Biotechnology: Biological Products (No Diagnostic Substances)
DCOM,Dime Community Bancshares Inc. Common Stock,$34.64 ,0.08,0.23%,1419245555,United States,,69131,Finance,Savings Institutions
DCOMP,Dime Community Bancshares Inc. Fixed-Rate Non-Cumulative Perpetual Preferred Stock Series A,$25.90 ,0.13,0.50%,0,United States,,2688,Finance,Savings Institutions
DCPH,Deciphera Pharmaceuticals Inc. Common Stock,$32.32 ,0.31,0.97%,1875898371,United States,2017,536640,Health Care,Biotechnology: Pharmaceutical Preparations
DCRC,Decarbonization Plus Acquisition Corporation III Class A Common Stock,$10.02 ,-0.19,-1.86%,438375000,United States,2021,1522792,,
DCRCU,Decarbonization Plus Acquisition Corporation III Unit,$10.92 ,-0.205,-1.84%,0,United States,2021,46432,,
DCRCW,Decarbonization Plus Acquisition Corporation III Warrant,$2.50 ,-0.06,-2.34%,0,United States,2021,91246,,
DCRD,Decarbonization Plus Acquisition Corporation IV Class A Ordinary Share,$9.91 ,0.002,0.02%,391636094,United States,2021,654,,
DCRDU,Decarbonization Plus Acquisition Corporation IV Unit,$10.19 ,0,0.00%,0,United States,2021,21,,
DCRDW,Decarbonization Plus Acquisition Corporation IV Warrant,$0.68 ,0.0801,13.35%,0,United States,2021,529239,,
DCRN,Decarbonization Plus Acquisition Corporation II Class A Common stock,$9.91 ,0.01,0.10%,498596875,United States,2021,14429,,
DCRNU,Decarbonization Plus Acquisition Corporation II Unit,$10.28 ,-0.0093,-0.09%,0,United States,2021,2747,,
DCRNW,Decarbonization Plus Acquisition Corporation II Warrant,$1.20 ,-0.02,-1.64%,0,United States,2021,13444,,
DCTH,Delcath Systems Inc. Common Stock,$9.22 ,-0.24,-2.54%,67824985,United States,,20031,Health Care,Medical Specialities
DDI,DoubleDown Interactive Co. Ltd. American Depository Shares,$17.62 ,0,0.00%,873131613,South Korea,2021,134840,Technology,EDP Services
DDMX,DD3 Acquisition Corp. II Class A Common Stock,$9.97 ,0.05,0.50%,159470150,Mexico,2021,388,,
DDMXW,DD3 Acquisition Corp. II Warrant,$1.20 ,0,0.00%,0,Mexico,2021,12,,
DENN,Denny's Corporation Common Stock,$15.80 ,-0.605,-3.69%,1014038968,United States,,467018,Consumer Services,Restaurants
DFFN,Diffusion Pharmaceuticals Inc. Common Stock,$0.48 ,0.0043,0.91%,48883339,United States,,856891,Health Care,Biotechnology: Pharmaceutical Preparations
DFH,Dream Finders Homes Inc. Class A Common Stock,$16.05 ,-0.28,-1.72%,1484969786,United States,2021,131867,,
DFPH,DFP Healthcare Acquisitions Corp. Class A Common Stock,$9.95 ,-0.01,-0.10%,286062500,United States,2020,124,Finance,Major Banks
DFPHU,DFP Healthcare Acquisitions Corp. Unit,$10.70 ,0,0.00%,0,United States,2020,5,Finance,Major Banks
DFPHW,DFP Healthcare Acquisitions Corp. Warrant,$1.65 ,0.185,12.63%,0,United States,2020,934,Finance,Major Banks
DGICA,Donegal Group Inc. Class A Common Stock,$15.05 ,0.22,1.48%,470241404,United States,,23290,Finance,Property-Casualty Insurers
DGICB,Donegal Group Inc. Class B Common Stock,$14.83 ,-0.0143,-0.10%,463233088,United States,1986,409,Finance,Property-Casualty Insurers
DGII,Digi International Inc. Common Stock,$21.12 ,-0.18,-0.85%,720424193,United States,1989,30826,Technology,Computer peripheral equipment
DGLY,Digital Ally Inc. Common Stock,$1.16 ,-0.04,-3.33%,59813882,United States,,548409,Miscellaneous,Diversified Manufacture
DGNS,Dragoneer Growth Opportunities Corp. II Class A Ordinary Shares,$9.92 ,0,0.00%,349699840,United States,2020,15216,Finance,Business Services
DGNU,Dragoneer Growth Opportunities Corp. III Class A Ordinary Shares,$9.83 ,0.01,0.10%,529193214,United States,2021,8750,Finance,Business Services
DHBC,DHB Capital Corp. Class A common stock,$9.71 ,-0.045,-0.46%,348953125,United States,2021,100000,,
DHBCU,DHB Capital Corp. Unit,$9.95 ,0.07,0.71%,357578125,United States,2021,1207,,
DHBCW,DHB Capital Corp. Warrant,$0.63 ,0.0598,10.49%,0,United States,2021,21186,,
DHC,Diversified Healthcare Trust Common Shares of Beneficial Interest,$3.53 ,0.07,2.02%,841462239,United States,,807524,Consumer Services,Real Estate Investment Trusts
DHCA,DHC Acquisition Corp. Class A ordinary share,$9.78 ,0,0.00%,378303505,United States,2021,1457,Finance,Business Services
DHCAU,DHC Acquisition Corp. Unit,$9.91 ,-0.01,-0.10%,0,United States,2021,650,Finance,Business Services
DHCAW,DHC Acquisition Corp. Warrant,$0.65 ,-0.0294,-4.33%,0,United States,2021,2253,Finance,Business Services
DHCNI,Diversified Healthcare Trust 5.625% Senior Notes due 2042,$24.50 ,0.1,0.41%,0,United States,,10335,Consumer Services,Real Estate Investment Trusts
DHCNL,Diversified Healthcare Trust 6.25% Senior Notes Due 2046,$25.39 ,0.14,0.55%,0,United States,,17332,Consumer Services,Real Estate Investment Trusts
DHHC,DiamondHead Holdings Corp. Class A Common Stock,$9.80 ,0.01,0.10%,422625000,United States,2021,3534,,
DHHCU,DiamondHead Holdings Corp. Unit,$9.90 ,-0.005,-0.05%,0,United States,2021,2032,,
DHHCW,DiamondHead Holdings Corp. Warrant,$0.64 ,-0.0001,-0.02%,0,United States,2021,5,,
DHIL,Diamond Hill Investment Group Inc. Class A Common Stock,$183.44 ,1.03,0.57%,587577214,United States,,1819,Finance,Investment Managers
DIBS,1stdibs.com Inc. Common Stock,$13.99 ,0.66,4.95%,529051716,United States,2021,123051,Miscellaneous,Diversified Commercial Services
DICE,DICE Therapeutics Inc. Common Stock,$26.49 ,-1.11,-4.02%,963355313,United States,2021,69127,Health Care,Biotechnology: Pharmaceutical Preparations
DILA,DILA Capital Acquisition Corp. Class A Common Stock,$9.74 ,0.02,0.21%,73824087,Mexico,2021,1199,,
DILAW,DILA Capital Acquisition Corp. Warrant,$0.54 ,-0.0099,-1.80%,0,Mexico,2021,984,,
DISA,Disruptive Acquisition Corporation I Class A Ordinary Shares,$9.70 ,-0.07,-0.72%,333437500,United States,2021,638,Finance,Business Services
DISAU,Disruptive Acquisition Corporation I Unit,$9.92 ,0,0.00%,0,United States,2021,371,Finance,Business Services
DISAW,Disruptive Acquisition Corporation I Warrant,$0.63 ,-0.0601,-8.71%,0,United States,2021,12428,Finance,Business Services
DJCO,Daily Journal Corp. (S.C.) Common Stock,$326.25 ,-4.28,-1.30%,450468383,United States,,1548,Consumer Services,Newspapers/Magazines
DKDCA,Data Knights Acquisition Corp. Class A Common Stock,$10.05 ,0,0.00%,150350764,United Kingdom,2021,17138,,
DKDCU,Data Knights Acquisition Corp. Unit,$10.40 ,0.01,0.10%,0,United Kingdom,2021,5300,,
DKDCW,Data Knights Acquisition Corp. Warrant,$0.40 ,0.0002,0.05%,0,United Kingdom,2021,5230,,
DLCA,Deep Lake Capital Acquisition Corp. Class A Ordinary Shares,$9.76 ,-0.01,-0.10%,252540000,United States,2021,601,Finance,Business Services
DLCAU,Deep Lake Capital Acquisition Corp. Unit,$10.09 ,0.0699,0.70%,0,United States,2021,5525,Finance,Business Services
DLCAW,Deep Lake Capital Acquisition Corp. Warrant,$0.84 ,0.059,7.56%,0,United States,2021,4300,Finance,Business Services
DLHC,DLH Holdings Corp.,$12.38 ,0.07,0.57%,155305936,United States,,8756,Miscellaneous,Business Services
DLPN,Dolphin Entertainment Inc. Common Stock,$14.21 ,0.97,7.33%,108570141,United States,,287824,,
DLTH,Duluth Holdings Inc. Class B Common Stock,$14.19 ,-0.08,-0.56%,469073225,United States,2015,98129,Consumer Services,Department/Specialty Retail Stores
DMAC,DiaMedica Therapeutics Inc. Common Stock,$3.94 ,-0.09,-2.23%,73831952,United States,2018,52911,,
DMLP,Dorchester Minerals L.P. Common Units Representing Limited Partnership Interests,$20.62 ,0.4,1.98%,730046440,United States,,67897,Energy,Oil & Gas Production
DMRC,Digimarc Corporation Common Stock,$33.99 ,-0.44,-1.28%,575466335,United States,,36844,Technology,EDP Services
DMTK,DermTech Inc. Common Stock,$32.24 ,-1.53,-4.53%,954637265,United States,2017,216316,Health Care,Managed Health Care
DNAA,Social Capital Suvretta Holdings Corp. I Class A Ordinary Share,$9.82 ,0.0001,0.00%,313896300,United States,2021,13215,,
DNAB,Social Capital Suvretta Holdings Corp. II Class A Ordinary Shares,$9.84 ,0.0052,0.05%,314541993,United States,2021,617,,
DNAC,Social Capital Suvretta Holdings Corp. III Class A ordinary shares,$9.82 ,-0.05,-0.51%,313896300,United States,2021,2354,,
DNAD,Social Capital Suvretta Holdings Corp. IV Class A Ordinary Shares,$9.83 ,-0.0245,-0.25%,314072108,United States,2021,1149,Health Care,Biotechnology: Pharmaceutical Preparations
DNAY,Codex DNA Inc. Common Stock,$10.18 ,-0.72,-6.61%,298189944,United States,2021,153965,Health Care,Medical Specialities
DOGZ,Dogness (International) Corporation Class A Common Stock,$3.19 ,0,0.00%,101451359,China,2017,1170000,Consumer Durables,Miscellaneous manufacturing industries
DOYU,DouYu International Holdings Limited ADS,$3.49 ,0.11,3.25%,1132190167,China,2019,2525765,Technology,Computer Software: Programming Data Processing
DPRO,Draganfly Inc. Common Shares,$3.02 ,0.02,0.67%,97068463,Canada,,131929,Consumer Durables,Electronic Components
DRAY,Macondray Capital Acquisition Corp. I Class A Ordinary Shares,$9.83 ,-0.01,-0.10%,316403125,United States,2021,7802,,
DRAYU,Macondray Capital Acquisition Corp. I Unit,$9.97 ,0.035,0.35%,0,United States,2021,6500,,
DRAYW,Macondray Capital Acquisition Corp. I Warrant,$0.53 ,-0.01,-1.85%,0,United States,2021,12845,,
DRIO,DarioHealth Corp. Common Stock,$12.77 ,-0.37,-2.82%,210824591,Israel,,56052,Health Care,Medical/Dental Instruments
DRMA,Dermata Therapeutics Inc. Common Stock,$4.32 ,0.01,0.23%,35979677,United States,2021,46853,Health Care,Biotechnology: Pharmaceutical Preparations
DRMAW,Dermata Therapeutics Inc. Warrant,$1.12 ,0.1299,13.12%,0,United States,2021,600,Health Care,Biotechnology: Pharmaceutical Preparations
DRNA,Dicerna Pharmaceuticals Inc. Common Stock,$19.91 ,-0.07,-0.35%,1547687365,United States,2014,286310,Health Care,Biotechnology: Commercial Physical & Biological Resarch
DRRX,DURECT Corporation Common Stock,$1.22 ,0,0.00%,277545340,United States,2000,210993,Health Care,Biotechnology: Pharmaceutical Preparations
DRTT,DIRTT Environmental Solutions Ltd. Common Shares,$3.18 ,-0.01,-0.31%,271343301,Canada,,4228,,
DSAC,Duddell Street Acquisition Corp. Class A Ordinary Shares,$9.79 ,0,0.00%,214156250,Hong Kong,2020,600,Finance,Business Services
DSACU,Duddell Street Acquisition Corp. Unit,$10.09 ,0.01,0.10%,0,Hong Kong,2020,540,Finance,Business Services
DSACW,Duddell Street Acquisition Corp. Warrant,$0.68 ,-0.0001,-0.02%,0,Hong Kong,2020,690,Finance,Business Services
DSGN,Design Therapeutics Inc. Common Stock,$14.67 ,-0.56,-3.68%,808533074,United States,2021,103450,Health Care,Biotechnology: Pharmaceutical Preparations
DSKE,Daseke Inc. Common Stock,$9.91 ,0.2,2.06%,617627956,United States,2015,581588,,
DSKEW,Daseke Inc. Warrant,$0.27 ,0.031,12.97%,0,United States,2015,173801,,
DSP,Viant Technology Inc. Class A Common Stock,$12.82 ,-0.58,-4.33%,772470638,United States,2021,169986,Technology,EDP Services
DSPG,DSP Group Inc. Common Stock,$21.82 ,-0.03,-0.14%,527547551,United States,1994,119253,Technology,Semiconductors
DSWL,Deswell Industries Inc. Common Shares,$3.81 ,-0.105,-2.68%,60713261,Macau,1995,1624,Consumer Non-Durables,Plastic Products
DTEA,DAVIDsTEA Inc. Common Stock,$3.29 ,0.33,11.15%,86724298,Canada,2015,351301,,
DTIL,Precision BioSciences Inc. Common Stock,$10.19 ,-1,-8.94%,607097568,United States,2019,424348,Health Care,Biotechnology: Pharmaceutical Preparations
DTOC,Digital Transformation Opportunities Corp. Class A Common Stock,$9.69 ,-0.01,-0.10%,403951875,United States,2021,25011,,
DTOCU,Digital Transformation Opportunities Corp. Units,$9.86 ,0.0584,0.60%,0,United States,2021,390,,
DTOCW,Digital Transformation Opportunities Corp. Warrant,$0.65 ,0.0006,0.09%,0,United States,2021,25529,,
DTRTU,DTRT Health Acquisition Corp. Unit,$10.09 ,-0.04,-0.40%,0,United States,2021,4592,,
DTSS,Datasea Inc. Common Stock,$1.95 ,0,0.00%,46626532,China,,53393,Technology,Retail: Computer Software & Peripheral Equipment
