Symbol,Name,Last Sale,Net Change,% Change,Market Cap,Country,IPO Year,Volume,Sector,Industry
NXN,Nuveen New York Select Tax-Free Income Portfolio Common Stock,$13.63 ,-0.1562,-1.13%,53497090,United States,1992,10927,Finance,Trusts Except Educational Religious and Charitable
NXP,Nuveen Select Tax Free Income Portfolio Common Stock,$17.17 ,-0.0497,-0.29%,284850189,United States,1992,9962,Finance,Trusts Except Educational Religious and Charitable
NXQ,Nuveen Select Tax Free Income Portfolio II Common Stock,$15.67 ,-0.02,-0.13%,277616411,United States,1992,8874,Finance,Trusts Except Educational Religious and Charitable
NXR,Nuveen Select Tax Free Income Portfolio III Common Stock,$17.13 ,0.025,0.15%,223491153,United States,1992,12569,Finance,Trusts Except Educational Religious and Charitable
NXRT,NexPoint Residential Trust Inc. Common Stock,$63.50 ,-0.75,-1.17%,1597020365,United States,2015,76118,Consumer Services,Real Estate Investment Trusts
NXU,Novus Capital Corporation II Class A Common Stock,$9.85 ,0,0.00%,353984375,,2021,18261,,
NYC,New York City REIT Inc. Class A Common Stock,$8.16 ,-0.24,-2.86%,106844951,,2020,17979,Consumer Services,Real Estate Investment Trusts
OACB,Oaktree Acquisition Corp. II Class A Ordinary Shares,$9.82 ,-0.02,-0.20%,306875000,United States,2020,8680,Finance,Business Services
OCA,Omnichannel Acquisition Corp. Class A Common Stock,$9.92 ,0.03,0.30%,256060000,,2021,2106,,
OCFT,OneConnect Financial Technology Co. Ltd. American Depositary Shares each representing three ordinary shares,$3.84 ,-0.06,-1.54%,1497575236,China,2019,686000,Technology,Computer Software: Programming Data Processing
OCN,Ocwen Financial Corporation NEW Common Stock,$28.62 ,0.03,0.11%,262990039,United States,,16422,Finance,Finance: Consumer Services
ODC,Oil-Dri Corporation Of America Common Stock,$34.93 ,0.21,0.61%,258807722,United States,,5971,Basic Industries,Industrial Specialties
OEC,Orion Engineered Carbons S.A Common Shares,$18.67 ,-0.07,-0.37%,1129294474,Luxembourg,2014,73047,Basic Industries,Specialty Chemicals
OFG,OFG Bancorp Common Stock,$26.15 ,0,0.00%,1350965406,Puerto Rico,,66786,Finance,Major Banks
OG,Onion Global Limited American Depositary Shares (each ten (10) ADSs representing one (1) Class A Ordinary Share),$10.73 ,0.45,4.38%,957639731,,2021,94852,Consumer Services,Catalog/Specialty Distribution
OIA,Invesco Municipal Income Opportunities Trust Common Stock,$7.74 ,0.03,0.39%,368230887,United States,,90737,Finance,Finance Companies
OII,Oceaneering International Inc. Common Stock,$14.62 ,0.6,4.28%,1459009304,United States,,555123,Energy,Oilfield Services/Equipment
OIS,Oil States International Inc. Common Stock,$6.94 ,0.36,5.47%,425934554,United States,2001,943114,Energy,Metal Fabrications
OLP,One Liberty Properties Inc. Common Stock,$31.57 ,0,0.00%,657799750,United States,,33571,Consumer Services,Real Estate Investment Trusts
ONE,OneSmart International Education Group Limited ADS,$0.38 ,0.003,0.79%,61869669,,2018,2666263,Miscellaneous,Service to the Health Industry
ONTF,ON24 Inc. Common Stock,$18.96 ,-0.08,-0.42%,884502581,,2021,274717,Technology,Computer Software: Prepackaged Software
OOMA,Ooma Inc. Common Stock,$19.56 ,-0.52,-2.59%,459660000,,2015,38453,Consumer Services,Telecommunications Equipment
OPA,Magnum Opus Acquisition Limited Class A Ordinary Shares,$9.90 ,0,0.00%,247500000,,2021,10987,,
OPFI,OppFi Inc. Class A Common Stock,$7.41 ,-0.02,-0.27%,814839042,,2020,96602,Technology,EDP Services
OPP,RiverNorth/DoubleLine Strategic Opportunity Fund Inc. Common Stock,$14.81 ,0.03,0.20%,231983840,United States,2016,125980,Finance,Finance/Investors Services
OPY,Oppenheimer Holdings Inc. Class A Common Stock (DE),$50.13 ,0.45,0.91%,636639921,United States,,48162,Finance,Investment Bankers/Brokers/Service
OR,Osisko Gold Royalties Ltd Common Shares,$11.65 ,0.08,0.69%,1958388312,,2016,444950,,
ORC,Orchid Island Capital Inc. Common Stock,$5.02 ,0.02,0.40%,693036803,United States,2013,1880329,Consumer Services,Real Estate Investment Trusts
ORN,Orion Group Holdings Inc. Common,$5.08 ,-0.06,-1.17%,157030715,United States,,89012,Capital Goods,Oilfield Services/Equipment
OSG,Overseas Shipholding Group Inc. Class A Common Stock,$2.14 ,-0.01,-0.47%,186494261,United States,2015,80622,Energy,Oil & Gas Production
OSI,Osiris Acquisition Corp. Class A Common Stock,$9.81 ,0.11,1.13%,282037500,,2021,50196,,
OUST,Ouster Inc. Common Stock,$6.77 ,-0.33,-4.65%,1092294033,United States,2020,937162,Capital Goods,Industrial Machinery/Components
OWLT,Owlet Inc. Class A Common Stock,$4.26 ,-0.11,-2.52%,480318408,,2020,209044,Health Care,Biotechnology: Electromedical & Electrotherapeutic Apparatus
OXM,Oxford Industries Inc. Common Stock,$89.45 ,-3.6,-3.87%,1511266963,United States,,101606,Consumer Non-Durables,Apparel
PAI,Western Asset Investment Grade Income Fund Inc.,$15.78 ,-0.08,-0.50%,150056675,United States,,9090,Finance,Trusts Except Educational Religious and Charitable
PAM,Pampa Energia S.A. Pampa Energia S.A.,$18.15 ,0.11,0.61%,1010668902,Argentina,,67429,Public Utilities,Electric Utilities: Central
PAR,PAR Technology Corporation Common Stock,$65.02 ,-0.1,-0.15%,1745136865,United States,,159981,Technology,Computer Software: Prepackaged Software
PARR,Par Pacific Holdings Inc.  Common Stock,$15.36 ,0.22,1.45%,925098286,United States,,154231,Energy,Integrated oil Companies
PBC,Prospect Capital Corporation 6.875% Notes due 2029,$25.38 ,-0.065,-0.26%,0,United States,2018,9868,Finance,Finance/Investors Services
PBF,PBF Energy Inc. Class A Common Stock,$14.24 ,-0.22,-1.52%,1712331677,United States,2012,5727339,Energy,Integrated oil Companies
PBFX,PBF Logistics LP Common Units representing limited partner interests,$13.87 ,0.36,2.67%,867091760,,2014,127226,,
PBI,Pitney Bowes Inc. Common Stock,$7.28 ,-0.08,-1.09%,1280663966,United States,,697630,Miscellaneous,Office Equipment/Supplies/Services
PBT,Permian Basin Royalty Trust Common Stock,$6.29 ,0.11,1.78%,293169327,United States,,82348,Energy,Oil & Gas Production
PCF,High Income Securities Fund Common Stock,$9.08 ,0.05,0.55%,86149887,United States,,85613,Finance,Trusts Except Educational Religious and Charitable
PCGU,Pacific Gas & Electric Co. Equity Unit,$105.24 ,1.98,1.92%,0,United States,,457270,Public Utilities,Power Generation
PCK,Pimco California Municipal Income Fund II Common Shares of Beneficial Interest,$9.60 ,0.0111,0.12%,308793600,United States,2002,18358,Finance,Trusts Except Educational Religious and Charitable
PCM,PCM Fund Inc. Common Stock,$11.50 ,0.04,0.35%,134331500,United States,1993,15275,Finance,Trusts Except Educational Religious and Charitable
PCN,Pimco Corporate & Income Strategy Fund Common Stock,$18.38 ,-0.08,-0.43%,766023260,United States,2001,26777,Finance,Investment Managers
PCPC,Periphas Capital Partnering Corporation Class A Common Stock,$24.45 ,0.01,0.04%,434075520,,2021,1274,,
PCQ,PIMCO California Municipal Income Fund Common Stock,$18.85 ,-0.005,-0.03%,356170750,United States,2001,15814,Finance,Investment Managers
PDI,PIMCO Dynamic Income Fund Common Stock,$26.88 ,-0.15,-0.56%,1897674240,United States,2012,179492,Finance,Trusts Except Educational Religious and Charitable
PDO,PIMCO Dynamic Income Opportunities Fund Common Shares of Beneficial Interest,$21.32 ,-0.34,-1.57%,1505149360,,2021,115881,Finance,Trusts Except Educational Religious and Charitable
PDOT,Peridot Acquisition Corp. II Class A Ordinary Shares,$9.75 ,0,0.00%,497804239,,2021,156,,
PDS,Precision Drilling Corporation Common Stock,$45.03 ,1.85,4.28%,599098258,Canada,,56053,,
PDT,John Hancock Premium Dividend Fund,$16.94 ,-0.13,-0.76%,825847022,United States,,30626,Finance,Finance Companies
PEI,Pennsylvania Real Estate Investment Trust Common Stock,$1.74 ,-0.06,-3.33%,139557272,United States,,547546,Consumer Services,Real Estate Investment Trusts
PEO,Adams Natural Resources Fund Inc. Common Stock,$16.70 ,0.33,2.02%,402217479,United States,,56946,Consumer Services,Real Estate Investment Trusts
PFD,Flaherty & Crumrine Preferred and Income Fund Incorporated,$15.80 ,0.11,0.70%,180662224,United States,1991,24062,Finance,Investment Managers
PFH,Prudential Financial Inc. 4.125% Junior Subordinated Notes due 2060,$25.65 ,-0.06,-0.23%,0,United States,2020,54649,,
PFL,PIMCO Income Strategy Fund Shares of Beneficial Interest,$11.52 ,-0.13,-1.12%,394917120,United States,2003,72986,Finance,Finance Companies
PFN,PIMCO Income Strategy Fund II,$10.03 ,-0.07,-0.69%,770865680,United States,2004,137568,Finance,Finance/Investors Services
PFO,Flaherty & Crumrine Preferred and Income Opportunity Fund Incorporated,$12.78 ,0.0717,0.56%,163759239,United States,1992,3894,Finance,Finance Companies
PFS,Provident Financial Services Inc Common Stock,$24.71 ,0.08,0.33%,1927347605,United States,2003,145025,Finance,Savings Institutions
PGP,Pimco Global Stocksplus & Income Fund Pimco Global StocksPlus & Income Fund Common Shares of Beneficial Interest,$10.86 ,-0.13,-1.18%,120437400,United States,2005,52961,Finance,Finance Companies
PGTI,PGT Innovations Inc.,$20.10 ,-0.13,-0.64%,1197701273,United States,2006,135339,Capital Goods,Building Products
PGZ,Principal Real Estate Income Fund Common Shares of Beneficial Interest,$15.20 ,-0.07,-0.46%,103556414,,2013,6246,Finance,Investment Managers
PHD,Pioneer Floating Rate Fund Inc.,$11.51 ,0.02,0.17%,142381796,United States,2004,15905,Finance,Investment Managers
PHK,Pimco High Income Fund Pimco High Income Fund,$6.34 ,-0.08,-1.25%,848951360,United States,2003,326667,Finance,Finance/Investors Services
PHT,Pioneer High Income Fund Inc.,$10.12 ,0.07,0.70%,296502085,United States,,89686,Finance,Investment Managers
PHX,PHX Minerals Inc. Common Stock,$3.46 ,0.06,1.77%,105186118,United States,,143846,Energy,Oil & Gas Production
PIAI,Prime Impact Acquisition I Class A Ordinary Shares,$9.80 ,0,0.00%,354396077,,2020,109949,Finance,Business Services
PICC,Pivotal Investment Corporation III Class A Common Stock,$9.77 ,0.02,0.21%,337065000,,2021,28260,,
PIM,Putnam Master Intermediate Income Trust Common Stock,$4.06 ,-0.01,-0.25%,207765246,United States,1988,36942,Finance,Finance Companies
PINE,Alpine Income Property Trust Inc. Common Stock,$18.34 ,-0.14,-0.76%,207233710,United States,2019,22948,Consumer Services,Real Estate Investment Trusts
PIPP,Pine Island Acquisition Corp. Class A Common Stock,$9.79 ,0,0.00%,267252315,United States,2021,51060,,
PKE,Park Aerospace Corp. Common Stock,$13.80 ,-0.16,-1.15%,281300939,United States,,72684,,
PKO,Pimco Income Opportunity Fund Common Shares of Beneficial Interest,$25.04 ,-0.14,-0.56%,526140480,United States,,35695,Finance,Finance/Investors Services
PLOW,Douglas Dynamics Inc. Common Stock,$37.82 ,0.26,0.69%,869139567,United States,2010,61158,Capital Goods,Construction/Ag Equipment/Trucks
PLYM,Plymouth Industrial REIT Inc. Common Stock,$23.28 ,-0.22,-0.94%,742291926,United States,2017,182790,Consumer Services,Real Estate Investment Trusts
PMF,PIMCO Municipal Income Fund Common Stock,$14.64 ,-0.09,-0.61%,380420400,United States,2001,10913,Finance,Finance/Investors Services
PML,Pimco Municipal Income Fund II Common Shares of Beneficial Interest,$14.57 ,-0.07,-0.48%,920037220,United States,2002,88252,Finance,Investment Managers
PMM,Putnam Managed Municipal Income Trust Common Stock,$8.28 ,0,0.00%,404803147,United States,1989,39396,Finance,Investment Managers
PMO,Putnam Municipal Opportunities Trust Common Stock,$13.56 ,0.02,0.15%,462527342,United States,1993,47165,Finance,Finance Companies
PMT,PennyMac Mortgage Investment Trust Common Shares of Beneficial Interest,$20.27 ,0.02,0.10%,1983872514,United States,2009,581224,Consumer Services,Real Estate Investment Trusts
PMVC,PMV Consumer Acquisition Corp. Class A Common Stock,$9.80 ,-0.01,-0.10%,214375000,United States,2020,7255,,
PMX,PIMCO Municipal Income Fund III Common Shares of Beneficial Interest,$12.27 ,-0.15,-1.21%,407413080,United States,2002,78556,Finance,Trusts Except Educational Religious and Charitable
PNF,PIMCO New York Municipal Income Fund Common Stock,$12.67 ,-0.01,-0.08%,99320130,United States,2001,24542,Finance,Finance Companies
PNI,Pimco New York Municipal Income Fund II Common Shares of Beneficial Interest,$11.94 ,0.09,0.76%,133668300,United States,2002,24980,Finance,Trusts Except Educational Religious and Charitable
PNTM,Pontem Corporation Class A Ordinary Shares,$9.76 ,0.03,0.31%,841800000,,2021,154377,Finance,Business Services
POLY,Plantronics Inc. Common Stock,$23.29 ,-0.33,-1.40%,985674582,United States,,242739,Public Utilities,Telecommunications Equipment
POND,Angel Pond Holdings Corporation Class A Ordinary Shares,$9.76 ,-0.0119,-0.12%,323865016,,2021,326,,
PPT,Putnam Premier Income Trust Common Stock,$4.61 ,0,0.00%,471197979,United States,1988,106239,Finance,Finance Companies
PRA,ProAssurance Corporation Common Stock,$22.75 ,-0.77,-3.27%,1228086769,United States,,163373,Finance,Property-Casualty Insurers
PRLB,Proto Labs Inc. Common stock,$67.11 ,-1.76,-2.56%,1863044938,United States,2012,305282,Capital Goods,Office Equipment/Supplies/Services
PRO,PROS Holdings Inc. Common Stock,$34.13 ,-0.92,-2.63%,1514645168,United States,2007,343058,Technology,EDP Services
PRPB,CC Neuberger Principal Holdings II Class A Ordinary Shares,$9.85 ,0.03,0.31%,1068725000,United States,2020,680996,Finance,Business Services
PRPC,CC Neuberger Principal Holdings III Class A Ordinary Shares,$9.80 ,0.02,0.20%,542062500,,2021,165530,Finance,Business Services
PRS,Prudential Financial Inc. 5.625% Junior Subordinated Notes due 2058,$26.89 ,0.01,0.04%,915915537,United States,2018,12537,Finance,Investment Bankers/Brokers/Service
PRT,PermRock Royalty Trust Trust Units,$6.90 ,0.17,2.53%,83943551,United States,2018,24748,Energy,Oil & Gas Production
PRTY,Party City Holdco Inc. Common Stock,$7.58 ,-0.05,-0.66%,848302344,United States,2015,2475982,Miscellaneous,Diversified Commercial Services
PSF,Cohen & Steers Select Preferred and Income Fund Inc. Common Stock,$28.54 ,-0.07,-0.25%,343032763,,2010,10358,Finance,Investment Managers
PSPC,Post Holdings Partnering Corporation Series A Common Stock,$9.75 ,0,0.00%,431096250,,2021,669,,
PSTL,Postal Realty Trust Inc. Class A Common Stock,$18.70 ,0.19,1.03%,255904545,,2019,26385,Consumer Services,Real Estate Investment Trusts
PTA,Cohen & Steers Tax-Advantaged Preferred Securities and Income Fund Common Shares of Beneficial Interest,$25.09 ,0.02,0.08%,1386811036,,2020,38699,Finance,Trusts Except Educational Religious and Charitable
PUMP,ProPetro Holding Corp. Common Stock,$9.96 ,0.14,1.43%,1028469311,United States,2017,693301,Energy,Oilfield Services/Equipment
PV,Primavera Capital Acquisition Corporation Class A Ordinary Shares,$9.77 ,0,0.00%,525137500,,2021,304290,Finance,Business Services
PVG,Pretium Resources Inc. Ordinary Shares (Canada),$10.38 ,0.16,1.57%,1950381852,Canada,,700736,,
PVL,Permianville Royalty Trust Trust Units ,$2.04 ,0.04,2.00%,67320000,United States,2011,76496,Energy,Oil & Gas Production
PYN,PIMCO New York Municipal Income Fund III Common Shares of Beneficial Interest,$10.65 ,0.44,4.31%,61035150,United States,2002,1809,Finance,Investment Managers
PYS,Merrill Lynch Depositor Inc PPlus Tr Ser RRD-1 Tr Ctf Cl A,$24.00 ,-0.3,-1.24%,0,United States,,527,Finance,Trusts Except Educational Religious and Charitable
PYT,PPlus Tr GSC-2 Tr Ctf Fltg Rate,$24.40 ,-0.01,-0.04%,0,United States,,309,,
PZC,PIMCO California Municipal Income Fund III Common Shares of Beneficial Interest,$10.97 ,-0.0637,-0.58%,245656086,United States,2002,39461,Finance,Investment Managers
PZN,Pzena Investment Management Inc Class A Common Stock,$10.40 ,-0.16,-1.52%,753070656,United States,2007,49149,Finance,Investment Managers
QD,Qudian Inc. American Depositary Shares each representing one Class A Ordinary Share,$1.63 ,0.04,2.52%,412533763,China,2017,547258,Technology,Computer Software: Prepackaged Software
QFTA,Quantum FinTech Acquisition Corporation Common Stock,$9.82 ,0,0.00%,247034375,,2021,10,,
QUAD,Quad Graphics Inc Class A Common Stock,$4.17 ,-0.1,-2.34%,227782251,United States,,130089,Consumer Services,Recreational Products/Toys
QUOT,Quotient Technology Inc. Common Stock,$5.91 ,0.03,0.51%,556207901,,2014,913856,Technology,Advertising
QVCC,QVC Inc. 6.250% Senior Secured Notes due 2068,$25.50 ,0.02,0.08%,0,United States,2019,28920,,
QVCD,QVC Inc. 6.375% Senior Secured Notes due 2067,$25.80 ,-0.15,-0.58%,0,United States,2018,17214,,
RA,Brookfield Real Assets Income Fund Inc. Common Stock,$21.79 ,0.07,0.32%,999346882,,2016,165030,Finance,Investment Managers
RAAS,Cloopen Group Holding Limited American Depositary Shares each representing two Class A Ordinary Shares,$4.29 ,-0.02,-0.46%,705148046,,2021,371594,Technology,Computer Software: Prepackaged Software
RAD,Rite Aid Corporation Common Stock,$13.64 ,0.05,0.37%,760720027,United States,,1213449,Health Care,Medical/Nursing Services
RBAC,RedBall Acquisition Corp. Class A Ordinary Shares,$9.87 ,0.04,0.41%,709406250,United States,2020,4949493,Finance,Business Services
RBOT,Vicarious Surgical Inc. Class A Common Stock,$12.46 ,-0.32,-2.50%,1478034008,Hong Kong,2020,282286,Health Care,Medical Specialities
RC,Ready Capital Corproation Common Stock,$14.71 ,0.01,0.07%,1047815174,United States,2013,177387,Consumer Services,Real Estate Investment Trusts
RCA,Ready Capital Corporation 7.00% Convertible Senior Notes due 2023,$26.76 ,0.02,0.08%,0,United States,2017,1023,Consumer Services,Real Estate Investment Trusts
RCB,Ready Capital Corporation 6.20% Senior Notes due 2026,$25.98 ,0.12,0.46%,0,United States,2019,11836,,
RCC,Ready Capital Corporation 5.75% Senior Notes due 2026,$25.77 ,0.0199,0.08%,0,United States,2021,1066,Finance,Finance Companies
RCS,PIMCO Strategic Income Fund Inc.,$7.63 ,0.27,3.67%,338749110,United States,1994,479614,Finance,Investment Managers
RDW,Redwire Corporation Common Stock,$9.48 ,-0.29,-2.97%,565588868,United States,2021,430118,Capital Goods,Aerospace
RENN,Renren Inc. American Depositary Shares each representing fifteen Class A ordinary shares,$23.98 ,7.38,44.46%,575984157,China,2011,9023037,Technology,EDP Services
RES,RPC Inc. Common Stock,$5.45 ,0.27,5.21%,1175703626,United States,,1137253,Energy,Oilfield Services/Equipment
REV,Revlon Inc. New Common Stock,$10.09 ,-0.01,-0.10%,541356318,United States,1996,88755,Consumer Non-Durables,Package Goods/Cosmetics
REVG,REV Group Inc. Common Stock,$16.14 ,-0.5,-3.01%,1045022971,United States,2017,188734,Capital Goods,Industrial Machinery/Components
REX,REX American Resources Corporation,$83.55 ,1.06,1.29%,498871870,United States,,4507,Basic Industries,Automotive Aftermarket
RFI,Cohen & Steers Total Return Realty Fund Inc. Common Stock,$16.42 ,0.2,1.23%,431368654,United States,1993,61882,Finance,Investment Managers
RFL,Rafael Holdings Inc. Class B Common Stock,$31.84 ,-1.96,-5.80%,657829269,United States,2018,140145,Health Care,Biotechnology: Pharmaceutical Preparations
RFM,RiverNorth Flexible Municipal Income Fund Inc. Common Stock,$23.26 ,-0.0704,-0.30%,142227899,,2020,18575,Finance,Trusts Except Educational Religious and Charitable
RFMZ,RiverNorth Flexible Municipal Income Fund II Inc. Common Stock,$20.35 ,0.11,0.54%,495558235,,2021,22340,Finance,Trusts Except Educational Religious and Charitable
RFP,Resolute Forest Products Inc. Common Stock,$12.96 ,0.68,5.54%,1025020876,Canada,,752026,Basic Industries,Paper
RGR,Sturm Ruger & Company Inc. Common Stock,$76.05 ,-0.43,-0.56%,1338221430,United States,,47775,,
RGS,Regis Corporation Common Stock,$3.08 ,0.11,3.70%,110505894,United States,1991,8403380,,
RGT,Royce Global Value Trust Inc. Common Stock,$15.24 ,0.03,0.20%,85356070,,2013,2496,Finance,Trusts Except Educational Religious and Charitable
RIV,RiverNorth Opportunities Fund Inc. Common Stock,$17.19 ,0.13,0.76%,222944467,,2015,98366,Finance,Finance Companies
RKLY,Rockley Photonics Holdings Limited Ordinary Shares,$7.04 ,-0.15,-2.09%,888844049,,,740024,,
RKTA,Rocket Internet Growth Opportunities Corp. Class A Ordinary Shares,$9.75 ,0,0.00%,325406250,,2021,44,,
RM,Regional Management Corp. Common Stock,$56.47 ,-1.48,-2.55%,581267564,United States,2012,26252,Finance,Finance: Consumer Services
RMAX,RE/MAX Holdings Inc. Class A Common Stock,$31.88 ,0.01,0.03%,602245686,,2013,47578,Finance,Real Estate
RMI,RiverNorth Opportunistic Municipal Income Fund Inc. Common Stock,$22.88 ,-0.078,-0.34%,145833118,,2018,1863,Finance,Finance/Investors Services
RMM,RiverNorth Managed Duration Municipal Income Fund Inc. Common Stock,$19.66 ,-0.07,-0.36%,388078904,,2019,22732,Finance,Trusts Except Educational Religious and Charitable
RMO,Romeo Power Inc. Class A Common Stock,$4.64 ,-0.03,-0.64%,622022717,,2019,1585817,Capital Goods,Automotive Aftermarket
RMT,Royce Micro-Cap Trust Inc. Common Stock,$11.47 ,-0.06,-0.52%,508424175,United States,,69188,Finance,Investment Managers
RNGR,Ranger Energy Services Inc. Class A Common Stock,$10.35 ,-0.07,-0.67%,185230990,United States,2017,24698,Energy,Oilfield Services/Equipment
RNP,Cohen & Steers REIT and Preferred and Income Fund Inc. Common Shares,$25.90 ,-0.09,-0.35%,1232584989,United States,2003,50017,Finance,Investment Managers
RONI,Rice Acquisition Corp. II Class A Ordinary Shares,$9.89 ,-0.03,-0.30%,341229725,,2021,18370,,
ROSS,Ross Acquisition Corp II Class A Ordinary Shares,$9.77 ,0,0.00%,421331250,,2021,8874,,
RPT,RPT Realty Common Stock,$13.49 ,-0.17,-1.25%,1095029193,United States,,165771,Consumer Services,Real Estate Investment Trusts
RRD,R.R. Donnelley & Sons Company Common Stock,$5.13 ,-0.29,-5.35%,373464000,United States,,615494,Consumer Services,Advertising
RSF,RiverNorth Specialty Finance Corporation,$19.62 ,-0.0999,-0.51%,89395842,,2019,8526,Finance,Investment Managers
RVI,Retail Value Inc. Common Stock ,$27.70 ,0.14,0.51%,584945055,United States,2018,194424,Consumer Services,Real Estate Investment Trusts
RVT,Royce Value Trust Inc. Common Stock,$18.27 ,-0.06,-0.33%,1887245910,United States,1986,115388,Finance,Trusts Except Educational Religious and Charitable
RWT,Redwood Trust Inc. Common Stock,$13.40 ,0.19,1.44%,1514942655,United States,1995,774260,Consumer Services,Real Estate Investment Trusts
RYAM,Rayonier Advanced Materials Inc. Common Stock,$7.66 ,-0.02,-0.26%,488228124,United States,2014,272589,Basic Industries,Industrial Specialties
RYB,RYB Education Inc. American depositary shares each representing one Class A ordinary share,$2.85 ,-0.06,-2.06%,78621086,,2017,2713,Miscellaneous,Other Consumer Services
RYI,Ryerson Holding Corporation Common Stock,$21.54 ,-0.33,-1.51%,828742755,United States,2014,72590,Capital Goods,Office Equipment/Supplies/Services
RZA,Reinsurance Group of America Incorporated 6.20% Fixed-to-Floating Rate Subordinated Debentures due 2042,$26.13 ,0.06,0.23%,0,United States,,20539,Finance,Life Insurance
RZB,Reinsurance Group of America Incorporated 5.75% Fixed-To-Floating Rate Subordinated Debentures due 2056,$28.44 ,0.1,0.35%,0,United States,2016,15086,Finance,Life Insurance
SA,Seabridge Gold Inc. Ordinary Shares (Canada),$16.44 ,0.15,0.92%,1266774270,Canada,,209776,,
SAK,Saratoga Investment Corp 7.25% Notes due 2025,$26.03 ,-0.0554,-0.21%,0,United States,2020,374,Finance,Finance Companies
SAND          ,Sandstorm Gold Ltd. Ordinary Shares (Canada),$6.08 ,0.07,1.17%,1184934951,Canada,,1919655,,
SAR,Saratoga Investment Corp New,$29.31 ,-0.06,-0.20%,333103197,United States,,40176,Finance,Investment Managers
SB,Safe Bulkers Inc Common Stock ($0.001 par value),$4.91 ,-0.12,-2.39%,586687690,Monaco,2008,1618406,Transportation,Marine Transportation
SBBA,Scorpio Tankers Inc. 7.00% Senior Notes due 2025,$24.70 ,0,0.00%,0,Monaco,2020,5912,Transportation,Marine Transportation
SBH,Sally Beauty Holdings Inc. (Name to be changed from Sally Holdings Inc.) Common Stock,$15.73 ,-0.53,-3.26%,1778015697,United States,,915180,Miscellaneous,Diversified Commercial Services
SBI,Western Asset Intermediate Muni Fund Inc Common Stock,$9.85 ,0.0932,0.96%,138710803,United States,1992,14392,Finance,Finance/Investors Services
SBII,Sandbridge X2 Corp. Class A Common Stock,$9.73 ,0.0105,0.11%,289697672,,2021,20292,,
SBOW,SilverBow Resorces Inc. Common Stock,$29.47 ,1.7,6.12%,376040471,,,305089,Energy,Oil & Gas Production
SBR,Sabine Royalty Trust Common Stock,$44.77 ,1.43,3.30%,652717276,United States,,66395,Energy,Oil & Gas Production
SCD,LMP Capital and Income Fund Inc. Common Stock,$14.07 ,0.1,0.72%,252069439,United States,2004,16803,Finance,Trusts Except Educational Religious and Charitable
SCM,Stellus Capital Investment Corporation Common Stock,$13.18 ,0.15,1.15%,256825520,United States,2012,23101,Finance,Finance/Investors Services
SCS,Steelcase Inc. Common Stock,$12.41 ,-0.03,-0.24%,1407543230,United States,1998,350851,Consumer Durables,Office Equipment/Supplies/Services
SCU,Sculptor Capital Management Inc. Class A Common Stock,$27.97 ,-0.07,-0.25%,1625178390,United States,,177303,Finance,Investment Managers
SCVX,SCVX Corp. Class A Ordinary Shares,$9.95 ,0.0011,0.01%,286094125,,2020,145781,Finance,Business Services
SCX,L.S. Starrett Company (The) Common Stock,$12.04 ,0.7,6.17%,85577334,United States,,14303,Consumer Durables,Home Furnishings
SD,SandRidge Energy Inc. Common Stock,$13.65 ,0.38,2.86%,499436779,,2016,847580,Energy,Oil & Gas Production
SDHY,PGIM Short Duration High Yield Opportunities Fund Common Shares,$18.96 ,0.01,0.05%,467801142,,2020,41957,Finance,Finance/Investors Services
SEAH,Sports Entertainment Acquisition Corp. Class A Common Stock,$9.98 ,-0.005,-0.05%,561375000,United States,2020,196070,,
SFB,Stifel Financial Corporation 5.20% Senior Notes due 2047,$26.88 ,0.01,0.04%,0,United States,2017,6637,Finance,Investment Bankers/Brokers/Service
SFE,Safeguard Scientifics Inc. New Common Stock,$8.18 ,-0.23,-2.74%,170175141,United States,,135299,Finance,Finance/Investors Services
