Symbol,Name,Last Sale,Net Change,% Change,Market Cap,Country,IPO Year,Volume,Sector,Industry
LOMA,Loma Negra Compania Industrial Argentina Sociedad Anonima ADS,$6.80 ,-0.01,-0.15%,810595360,Argentina,2017,97894,Capital Goods,Building Materials
LPG,Dorian LPG Ltd. Common Stock,$12.69 ,0.02,0.16%,509381245,,2014,227117,Transportation,Marine Transportation
LPI,Laredo Petroleum Inc. Common Stock,$90.42 ,-1.62,-1.76%,1456632835,United States,2011,780127,Energy,Oil & Gas Production
LRN,Stride Inc. Common Stock,$36.95 ,0.29,0.79%,1536823033,United States,,349381,Miscellaneous,Other Consumer Services
LTC,LTC Properties Inc. Common Stock,$32.30 ,0,0.00%,1271781621,United States,,233488,Consumer Services,Real Estate Investment Trusts
LUB,Luby's Inc. Common Stock,$4.68 ,0.01,0.21%,144938992,United States,,12464,Consumer Services,Restaurants
LXU,LSB Industries Inc. Common Stock,$12.44 ,0.02,0.16%,987320205,United States,,153507,Basic Industries,Industrial Specialties
LZB,La-Z-Boy Incorporated Common Stock,$33.59 ,-0.16,-0.47%,1488815650,United States,,180400,Consumer Durables,Home Furnishings
MACC,Mission Advancement Corp. Class A Common Stock,$9.73 ,0,0.00%,419606250,,2021,100,,
MAV,Pioneer Municipal High Income Advantage Fund Inc.,$11.52 ,0.02,0.17%,275405092,United States,,59427,Finance,Finance Companies
MAX,MediaAlpha Inc. Class A Common Stock,$18.30 ,-0.65,-3.43%,717240410,,2020,89582,Capital Goods,Industrial Machinery/Components
MBAC,M3-Brigade Acquisition II Corp. Class A Common Stock,$9.90 ,0,0.00%,495000000,,2021,77260,,
MBI,MBIA Inc. Common Stock,$12.28 ,0.08,0.66%,668102843,United States,1987,154157,Finance,Property-Casualty Insurers
MCA,Blackrock MuniYield California Quality Fund Inc. Common Stock,$15.44 ,-0.01,-0.07%,531224270,United States,1992,36207,Finance,Trusts Except Educational Religious and Charitable
MCB,Metropolitan Bank Holding Corp. Common Stock,$86.83 ,0.38,0.44%,898186278,,2017,53555,Finance,Major Banks
MCG,Membership Collective Group Inc. Class A Common Stock,$12.05 ,-0.31,-2.51%,752874673,,2021,59160,Consumer Services,Hotels/Resorts
MCI,Barings Corporate Investors Common Stock,$15.38 ,-0.12,-0.77%,311625238,United States,,13058,Finance,Trusts Except Educational Religious and Charitable
MCN,Madison Covered Call & Equity Strategy Fund Common Stock,$7.96 ,-0.09,-1.12%,166824828,United States,2004,37561,,
MCR,MFS Charter Income Trust Common Stock,$8.64 ,0,0.00%,383630507,United States,1989,36570,Finance,Trusts Except Educational Religious and Charitable
MCS,Marcus Corporation (The) Common Stock,$18.51 ,-0.09,-0.48%,581618351,United States,,184708,Consumer Services,Movies/Entertainment
MDH,MDH Acquisition Corp. Class A Common Stock,$9.84 ,-0.01,-0.10%,339480000,,2021,9928,,
MDVA,Modiv Inc. 7.375% Series A Cumulative Redeemable Perpetual Preferred Stock,$25.61 ,-0.11,-0.43%,0,,2021,16412,Consumer Services,Real Estate Investment Trusts
MEC,Mayville Engineering Company Inc. Common Stock,$18.61 ,-0.52,-2.72%,381056778,,2019,86200,Capital Goods,Metal Fabrications
MEG,Montrose Environmental Group Inc. Common Stock,$61.21 ,-0.43,-0.70%,1756688866,United States,2020,335841,,
MEI,Methode Electronics Inc. Common Stock,$43.05 ,0.04,0.09%,1643258838,United States,,97849,Capital Goods,Electrical Products
MFD,Macquarie First Trust Global Common Stock,$9.53 ,0.1,1.06%,81457122,United States,2004,23062,Finance,Trusts Except Educational Religious and Charitable
MFGP,Micro Focus Intl PLC ADS each representing One Ord Sh,$5.13 ,-0.1,-1.91%,1721836801,,2017,401562,Technology,Computer Software: Prepackaged Software
MFL,Blackrock MuniHoldings Investment Quality Fund Common Shares of Beneficial Interest,$14.51 ,-0.11,-0.75%,549873978,United States,1997,18464,Finance,Finance Companies
MFM,MFS Municipal Income Trust Common Stock,$6.93 ,0,0.00%,285430283,United States,1986,43690,Finance,Finance Companies
MFV,MFS Special Value Trust Common Stock,$6.70 ,0.04,0.60%,48637873,United States,,7234,Finance,Trusts Except Educational Religious and Charitable
MG,Mistras Group Inc Common Stock,$9.73 ,0.12,1.25%,286372183,United States,2009,29426,Miscellaneous,Diversified Manufacture
MGF,MFS Government Markets Income Trust Common Stock,$4.32 ,0.0091,0.21%,140772773,United States,1987,56980,Finance,Trusts Except Educational Religious and Charitable
MGR,Affiliated Managers Group Inc. 5.875% Junior Subordinated Notes due 2059,$26.62 ,-0.03,-0.11%,0,United States,2019,13959,Finance,Investment Managers
MGRB,Affiliated Managers Group Inc. 4.750% Junior Subordinated Notes due 2060,$25.67 ,0.03,0.12%,0,United States,2020,35584,Finance,Investment Managers
MGRD,Affiliated Managers Group Inc. 4.200% Junior Subordinated Notes due 2061,$24.25 ,-0.005,-0.02%,0,United States,2021,6740,Finance,Investment Managers
MGU,Macquarie Global Infrastructure Total Return Fund Inc. Common Stock,$23.56 ,-0.01,-0.04%,293163983,United States,2005,22298,Finance,Trusts Except Educational Religious and Charitable
MHD,Blackrock MuniHoldings Fund Inc. Common Stock,$16.38 ,0,0.00%,873984187,United States,1997,43451,Finance,Trusts Except Educational Religious and Charitable
MHF,Western Asset Municipal High Income Fund Inc. Common Stock,$8.22 ,0.1,1.23%,177822717,United States,1988,17527,Finance,Finance/Investors Services
MHI,Pioneer Municipal High Income Fund Inc.,$11.86 ,0,0.00%,270068199,United States,2003,41484,Finance,Investment Managers
MHLA,Maiden Holdings Ltd. 6.625% Notes due 2046,$21.86 ,-0.18,-0.82%,0,Bermuda,2016,2645,Finance,Property-Casualty Insurers
MHN,Blackrock MuniHoldings New York Quality Fund Inc. Common Stock,$14.42 ,0,0.00%,448923772,United States,1997,19522,Finance,Finance Companies
MHNC,Maiden Holdings North America Ltd. 7.75% Notes due 2043,$23.83 ,0.06,0.25%,0,Bermuda,2013,3161,Finance,Property-Casualty Insurers
MHO,M/I Homes Inc. Common Stock,$58.35 ,-0.83,-1.40%,1710712886,United States,1993,141087,Capital Goods,Homebuilding
MIC,Macquarie Infrastructure Holdings LLC Common Unit,$3.71 ,0.3968,11.98%,326197777,United States,2004,37917134,Transportation,Aerospace
MIN,MFS Intermediate Income Trust Common Stock,$3.68 ,0.04,1.10%,426738515,United States,1988,395962,Finance,Trusts Except Educational Religious and Charitable
MIO,Pioneer Municipal High Income Opportunities Fund Inc. Common Stock,$19.90 ,0.055,0.28%,0,,2021,9533,,
MIT,Mason Industrial Technology Inc. Class A Common Stock,$9.75 ,0,0.00%,609375000,,2021,2,,
MITT,AG Mortgage Investment Trust Inc. Common Stock,$11.45 ,0,0.00%,185150072,United States,2011,38329,Consumer Services,Real Estate Investment Trusts
MIXT,MiX Telematics Limited American Depositary Shares each representing 25 Ordinary Shares,$12.76 ,-0.13,-1.01%,301463128,South Africa,2013,7425,Technology,Computer Software: Prepackaged Software
MIY,Blackrock MuniYield Michigan Quality Fund Inc. Common Stock,$15.60 ,-0.05,-0.32%,460348746,United States,1992,21499,Finance,Finance Companies
MKFG,Markforged Holding Corporation Common Stock,$6.35 ,0.01,0.16%,1176349165,United States,2020,430708,Technology,Retail: Computer Software & Peripheral Equipment
ML,MoneyLion Inc. Class A Common Stock,$5.93 ,-0.4,-6.32%,1346985908,United States,2020,328309,Technology,Retail: Computer Software & Peripheral Equipment
MLNK,MeridianLink Inc. Common Stock,$21.70 ,-0.32,-1.45%,1745560868,,2021,93721,,
MLP,Maui Land & Pineapple Company Inc. Common Stock,$10.30 ,0,0.00%,200290360,United States,,4689,Finance,Real Estate
MLR,Miller Industries Inc. Common Stock,$34.37 ,-0.09,-0.26%,392186721,United States,,17460,Capital Goods,Construction/Ag Equipment/Trucks
MMD,MainStay MacKay DefinedTerm Municipal Opportunities Fund,$21.28 ,-0.03,-0.14%,591269375,United States,2012,27520,Finance,Investment Managers
MMI,Marcus & Millichap Inc. Common Stock,$43.26 ,-0.59,-1.35%,1712200648,,2013,68519,Finance,Real Estate
MMT,MFS Multimarket Income Trust Common Stock,$6.41 ,-0.08,-1.23%,386706121,United States,1987,50190,Finance,Trusts Except Educational Religious and Charitable
MMU,Western Asset Managed Municipals Fund Inc. Common Stock,$13.13 ,0.01,0.08%,569419884,United States,1992,80207,Finance,Investment Managers
MN,Manning & Napier Inc. Class A Common Stock,$9.40 ,-0.05,-0.53%,173862475,United States,2011,14356,Finance,Investment Managers
MNP,Western Asset Municipal Partners Fund Inc. Common Stock,$15.49 ,0.005,0.03%,150499691,United States,1993,8922,Finance,Trusts Except Educational Religious and Charitable
MNR,Monmouth Real Estate Investment Corporation Class A Common Stock,$19.09 ,0.04,0.21%,1876589132,United States,,325789,Consumer Services,Real Estate Investment Trusts
MNRL,Brigham Minerals Inc. Class A Common Stock,$20.56 ,0.15,0.74%,1167531509,,2019,144320,Energy,Oil & Gas Production
MOD,Modine Manufacturing Company Common Stock,$11.67 ,0,0.00%,603957767,United States,,202494,Capital Goods,Auto Parts:O.E.M.
MODN,Model N Inc. Common Stock,$32.41 ,-0.74,-2.23%,1159759537,United States,2013,66260,Technology,EDP Services
MOGU,MOGU Inc. American Depositary Shares (each  representing 25 Class A Ordinary Shares),$0.98 ,0.0022,0.23%,98037032,,2018,54655,Miscellaneous,Business Services
MOTV,Motive Capital Corp Class A Ordinary Shares,$9.90 ,0.02,0.20%,512325000,,2021,1475497,Finance,Business Services
MOV,Movado Group Inc. Common Stock,$32.37 ,-0.62,-1.88%,745906086,United States,,47038,Consumer Non-Durables,Consumer Specialties
MPA,Blackrock MuniYield Pennsylvania Quality Fund Common Stock,$16.12 ,0.1598,1.00%,214506390,United States,1992,7867,Finance,Finance Companies
MPV,Barings Participation Investors Common Stock,$13.79 ,0,0.00%,146197443,United States,1988,10611,Finance,Finance Companies
MPX,Marine Products Corporation Common Stock,$12.75 ,-0.01,-0.08%,433421639,United States,,13989,Consumer Non-Durables,Recreational Products/Toys
MQT,Blackrock MuniYield Quality Fund II Inc. Common Stock,$14.50 ,0.01,0.07%,327187933,United States,1992,25887,Finance,Investment Managers
MQY,Blackrock MuniYield Quality Fund Inc. Common Stock,$16.10 ,-0.06,-0.37%,1178339052,United States,1992,64801,Finance,Investment Managers
MRC,MRC Global Inc. Common Stock,$7.79 ,0.3,4.01%,643963754,United States,2012,4662091,Capital Goods,Fluid Controls
MSB,Mesabi Trust Common Stock,$34.26 ,0,0.00%,449491543,United States,,32976,Basic Industries,Steel/Iron Ore
MSC,Studio City International Holdings Limited American depositary shares each representing four  Class A ordinary shares,$8.50 ,-0.027,-0.32%,941086978,,2018,1282,Consumer Services,Hotels/Resorts
MSD,Morgan Stanley Emerging Markets Debt Fund Inc. Common Stock,$9.02 ,-0.01,-0.11%,183888214,United States,1993,38165,Finance,Trusts Except Educational Religious and Charitable
MTAL,Metals Acquisition Corp Class A Ordinary Shares,$9.79 ,0,0.00%,329945321,,2021,1891,,
MTCN,ArcelorMittal 5.50% Mandatorily Convertible Subordinated Notes due 2023,$68.54 ,-0.04,-0.06%,0,Luxembourg,2020,4334,Basic Industries,Steel/Iron Ore
MTL,Mechel PAO American Depositary Shares (Each rep. 1 common shares),$4.11 ,-0.05,-1.20%,1116960397,Russia,2004,305735,Basic Industries,Steel/Iron Ore
MTOR,Meritor Inc. Common Stock,$25.51 ,0.7,2.82%,1789355660,United States,,468759,Capital Goods,Auto Parts:O.E.M.
MTR,Mesa Royalty Trust Common Stock,$5.95 ,0.05,0.85%,11088361,United States,,12384,Energy,Oil & Gas Production
MTRN,Materion Corporation,$70.57 ,-0.71,-1.00%,1442284678,United States,,34679,,
MTW,Manitowoc Company Inc. (The) Common Stock,$20.96 ,-0.73,-3.37%,733709851,United States,,171418,Capital Goods,Construction/Ag Equipment/Trucks
MUA,Blackrock MuniAssets Fund Inc Common Stock,$14.99 ,-0.05,-0.33%,567311540,United States,1993,34590,Finance,Trusts Except Educational Religious and Charitable
MUC,Blackrock MuniHoldings California Quality Fund Inc.  Common Stock,$15.46 ,-0.08,-0.52%,634039893,United States,1998,29491,Finance,Finance Companies
MUE,Blackrock MuniHoldings Quality Fund II Inc. Common Stock,$13.95 ,0,0.00%,314164588,United States,,5838,Finance,Trusts Except Educational Religious and Charitable
MUI,BlackRock Municipal Income Fund Inc. Common Stock,$15.16 ,-0.25,-1.62%,580571393,United States,2003,59420,Finance,Trusts Except Educational Religious and Charitable
MUJ,Blackrock MuniHoldings New Jersey Quality Fund Inc. Common Stock,$15.46 ,-0.02,-0.13%,465147633,United States,1998,49517,Finance,Trusts Except Educational Religious and Charitable
MUX,McEwen Mining Inc. Common Stock,$1.09 ,0.01,0.93%,500514256,Canada,,1909926,Basic Industries,Precious Metals
MVF,Blackrock MuniVest Fund Inc. Common Stock,$9.51 ,0.05,0.53%,616593888,United States,,51680,Finance,Finance/Investors Services
MVO,MV Oil Trust Units of Beneficial Interests,$9.41 ,0.23,2.51%,108215000,United States,2007,278468,Energy,Oil & Gas Production
MVT,Blackrock MuniVest Fund II Inc.  Common Stock,$15.41 ,0,0.00%,329021360,United States,1993,11553,Finance,Trusts Except Educational Religious and Charitable
MX,Magnachip Semiconductor Corporation Common Stock,$17.66 ,-0.04,-0.23%,814668621,Luxembourg,2011,303613,Technology,Semiconductors
MXE,Mexico Equity and Income Fund Inc. (The) Common Stock,$9.62 ,-0.43,-4.28%,17185774,United States,,66823,Finance,Finance Companies
MXF,Mexico Fund Inc. (The) Common Stock,$14.76 ,-0.06,-0.41%,221477106,United States,,2988,Finance,Trusts Except Educational Religious and Charitable
MYC,Blackrock MuniYield California Fund Inc. Common Stock,$15.18 ,-0.04,-0.26%,325147919,United States,1992,5310,Finance,Trusts Except Educational Religious and Charitable
MYD,Blackrock MuniYield Fund Inc.  Common Stock,$14.60 ,0.01,0.07%,685027547,United States,1991,36794,Finance,Trusts Except Educational Religious and Charitable
MYE,Myers Industries Inc. Common Stock,$20.35 ,-0.23,-1.12%,736137848,United States,,46413,Capital Goods,Auto Parts:O.E.M.
MYI,Blackrock MuniYield Quality Fund III Inc Common Stock,$14.62 ,0.08,0.55%,996362956,United States,,51796,Finance,Finance Companies
MYJ,Blackrock MuniYield New Jersey Fund Inc Common Stock,$15.46 ,-0.05,-0.32%,372963487,United States,1992,28174,Finance,Finance Companies
MYN,Blackrock MuniYield New York Quality Fund Inc.Common Stock,$13.91 ,0.06,0.43%,550649383,United States,1992,28490,Finance,Finance Companies
MYOV,Myovant Sciences Ltd. Common Shares,$20.10 ,-0.6,-2.90%,1850764986,United States,2016,236139,Health Care,Biotechnology: Pharmaceutical Preparations
NAN,Nuveen New York Quality Municipal Income Fund Common Stock,$14.71 ,0.01,0.07%,453823094,United States,1999,11450,Finance,Investment Managers
NAT,Nordic American Tankers Limited Common Stock,$2.51 ,-0.09,-3.46%,431630677,Bermuda,,1533982,Transportation,Marine Transportation
NAZ,Nuveen Arizona Quality Municipal Income Fund Common Stock,$15.87 ,0.1819,1.16%,183709513,United States,1992,416,Finance,Finance/Investors Services
NBB,Nuveen Taxable Municipal Income Fund Common Shares of Beneficial Interest,$22.70 ,0.04,0.18%,637094568,United States,2010,23926,Finance,Finance Companies
NBHC,National Bank Holdings Corporation Common Stock,$42.38 ,0.05,0.12%,1305345744,United States,2012,79715,Finance,Major Banks
NBR,Nabors Industries Ltd.,$110.82 ,4.5,4.23%,913328793,Bermuda,,185593,Energy,Oil & Gas Production
NBXG,Neuberger Berman Next Generation Connectivity Fund Inc. Common Stock,$18.50 ,-0.26,-1.39%,0,,2021,104047,,
NC,NACCO Industries Inc. Common Stock,$33.82 ,1.34,4.13%,242219212,United States,,12301,,
NCA,Nuveen California Municipal Value Fund,$10.32 ,0.01,0.10%,289957769,United States,,15133,Finance,Investment Managers
NCV,Virtus AllianzGI Convertible & Income Fund Common Shares of Beneficial Interest,$6.11 ,-0.03,-0.49%,552182507,United States,2003,254085,Finance,Finance Companies
NCZ,Virtus AllianzGI Convertible & Income Fund II Common Shares of Beneficial Interest,$5.26 ,-0.02,-0.38%,400368840,United States,2003,350568,Finance,Finance Companies
NDMO,Nuveen Dynamic Municipal Opportunities Fund Common Shares of Beneficial Interest,$16.03 ,0.13,0.82%,913918390,,2020,643751,Finance,Trusts Except Educational Religious and Charitable
NDP,Tortoise Energy Independence Fund Inc. Common Stock,$23.08 ,0.45,1.99%,42605680,United States,2012,21279,Finance,Finance/Investors Services
NE,Noble Corporation plc Ordinary Shares,$26.56 ,-1.1,-3.98%,1597833797,,2021,211980,Energy,Oil & Gas Production
NETI,Eneti Inc. Common Stock,$16.03 ,-0.54,-3.26%,292284672,Monaco,2013,34963,Transportation,Marine Transportation
NEV,Nuveen Enhanced Municipal Value Fund Common Shares of Beneficial Interest,$15.53 ,-0.03,-0.19%,387581045,United States,2009,23971,Finance,Trusts Except Educational Religious and Charitable
NEW,Puxin Limited American Depositary Shares each representing two Ordinary Shares,$0.56 ,-0.0031,-0.55%,48988246,,2018,680004,Miscellaneous,Service to the Health Industry
NEX,NexTier Oilfield Solutions Inc. Common Stock,$4.82 ,0.14,2.99%,1165235925,United States,2017,1387231,Energy,Oilfield Services/Equipment
NEXA,Nexa Resources S.A. Common Shares,$9.83 ,0.84,9.34%,1301871546,,2017,344988,Basic Industries,Precious Metals
NFH,New Frontier Health Corporation Ordinary Shares,$11.50 ,0.03,0.26%,1516248481,,2018,148593,Health Care,Hospital/Nursing Management
NFJ,Virtus Dividend Interest & Premium Strategy Fund Common Shares of Beneficial Interest,$14.92 ,-0.05,-0.33%,1414439589,United States,2005,136924,Finance,Trusts Except Educational Religious and Charitable
NGAB,Northern Genesis Acquisition Corp. II Common Stock,$9.93 ,0,0.00%,513877500,,2021,131998,,
NGC,Northern Genesis Acquisition Corp. III Common Stock,$9.77 ,-0.01,-0.10%,210604563,,2021,1653,,
NGL,NGL ENERGY PARTNERS LP Common Units representing Limited Partner Interests,$2.41 ,0.06,2.55%,312321393,United States,2011,641421,,
NGS,Natural Gas Services Group Inc. Common Stock,$12.28 ,0.41,3.45%,161890457,United States,2002,72324,Energy,Metal Fabrications
NGVC,Natural Grocers by Vitamin Cottage Inc. Common Stock,$11.35 ,-0.05,-0.44%,256727466,United States,2012,41427,Consumer Services,Food Chains
NHF,NexPoint Strategic Opportunities Fund,$14.05 ,-0.02,-0.14%,519746114,,,18634,Finance,Investment Managers
NID,Nuveen Intermediate Duration Municipal Term Fund Common Shares of Beneficial Interest,$14.71 ,0.04,0.27%,690041099,United States,2012,87718,Finance,Finance Companies
NIE,Virtus AllianzGI Equity & Convertible Income Fund Common Shares of Beneficial Interest,$29.80 ,-0.06,-0.20%,825727157,United States,2007,28289,Finance,Investment Managers
NIM,Nuveen Select Maturities Municipal Fund Common Stock,$10.54 ,-0.0066,-0.06%,131216440,United States,1992,1271,Finance,Trusts Except Educational Religious and Charitable
NIMC,NiSource Inc Series A Corporate Units,$104.56 ,0.1,0.10%,0,United States,2021,2528,Public Utilities,Power Generation
NINE,Nine Energy Service Inc. Common Stock,$2.20 ,0.09,4.27%,68971489,United States,2018,401801,Energy,Oilfield Services/Equipment
NIQ,Nuveenn Intermediate Duration Quality Municipal Term Fund Common Shares of Beneficial Interest,$14.75 ,0,0.00%,193182874,,2013,4549,Finance,Finance/Investors Services
NKG,Nuveen Georgia Quality Municipal Income Fund ,$13.66 ,-0.14,-1.01%,142061446,United States,2002,2243,Finance,Finance/Investors Services
NKX,Nuveen California AMT-Free Quality Municipal Income Fund,$16.20 ,-0.06,-0.37%,769829411,United States,2002,36886,Finance,Finance/Investors Services
NL,NL Industries Inc. Common Stock,$6.35 ,-0.22,-3.35%,309897361,United States,,30162,Consumer Services,Diversified Commercial Services
NLS,Nautilus Inc. Common Stock,$9.28 ,-0.38,-3.93%,287036896,United States,,435903,Consumer Non-Durables,Recreational Products/Toys
NM,Navios Maritime Holdings Inc. Common Stock,$6.39 ,0.19,3.07%,101582239,Monaco,,541538,Finance,Business Services
NMCO,Nuveen Municipal Credit Opportunities Fund Common Shares,$15.08 ,-0.04,-0.27%,803403286,,2019,35624,Finance,Finance/Investors Services
NMG,Nouveau Monde Graphite Inc. Common Shares,$6.00 ,0.05,0.84%,281876370,,,34414,,
NMI,Nuveen Municipal Income Fund Inc. Common Stock,$11.71 ,-0.03,-0.26%,113393141,United States,1988,10689,Finance,Trusts Except Educational Religious and Charitable
NMM,Navios Maritime Partners LP Common Units Representing Limited Partner Interests,$30.56 ,-1.03,-3.26%,819278792,Greece,2007,284511,Transportation,Marine Transportation
NMS,Nuveen Minnesota Quality Municipal Income Fund ,$15.64 ,0.0025,0.02%,90450962,United States,2014,5618,Finance,Finance Companies
NMT,Nuveen Massachusetts Quality Municipal Income Fund Common Stock,$15.46 ,0.12,0.78%,144129730,United States,,351,Finance,Finance/Investors Services
NMZ,Nuveen Municipal High Income Opportunity Fund Common Stock $0.01 par value per share,$14.69 ,-0.04,-0.27%,1306338262,United States,2003,199571,Finance,Finance/Investors Services
NNA,Navios Maritime Acquisition Corporation Common stock,$3.91 ,-0.1,-2.49%,69347627,Greece,,331611,Transportation,Marine Transportation
NNY,Nuveen New York Municipal Value Fund Common Stock,$9.73 ,-0.18,-1.82%,183761276,United States,1988,84975,Finance,Investment Managers
NOA,North American Construction Group Ltd. Common Shares (no par),$15.63 ,0.26,1.69%,444180592,Canada,2006,26274,,Farming/Seeds/Milling
NOM,Nuveen Missouri Quality Municipal Income Fund ,$15.42 ,0,0.00%,36193346,United States,1993,2,Finance,Investment Managers
NP,Neenah Inc. Common Stock,$48.49 ,-0.08,-0.17%,817667329,United States,,35859,Basic Industries,Paper
NPCT,Nuveen Core Plus Impact Fund Common Shares of Beneficial Interest,$19.00 ,-0.04,-0.21%,0,,2021,24524,,
NPK,National Presto Industries Inc. Common Stock,$82.96 ,0.27,0.33%,583867336,United States,,8903,Consumer Non-Durables,Military/Government/Technical
NPO,EnPro Industries Inc,$88.73 ,-1.24,-1.38%,1827980767,United States,,30483,,
NPTN,NeoPhotonics Corporation Common Stock,$8.82 ,0.02,0.23%,460275449,United States,2011,231294,Technology,Semiconductors
NPV,Nuveen Virginia Quality Municipal Income Fund Common Stock,$16.61 ,0.1295,0.79%,297276860,United States,1993,4573,Finance,Investment Managers
NQP,Nuveen Pennsylvania Quality Municipal Income Fund Common Stock,$14.88 ,0.04,0.27%,556264114,United States,1991,25824,Finance,Trusts Except Educational Religious and Charitable
NR,Newpark Resources Inc. Common Stock,$3.67 ,-0.02,-0.54%,337933912,United States,,485390,Energy,Metal Fabrications
NRDY,Nerdy Inc. Class A Common Stock,$9.84 ,0.32,3.36%,888223157,United States,2020,373357,Technology,Computer Software: Prepackaged Software
NREF,NexPoint Real Estate Finance Inc. Common Stock,$20.21 ,0.61,3.11%,181447644,,2020,53715,Consumer Services,Real Estate Investment Trusts
NRGX,PIMCO Energy and Tactical Credit Opportunities Fund Common Shares of Beneficial Interest,$12.86 ,0.19,1.50%,574932020,,2019,204179,Finance,Finance/Investors Services
NRK,Nuveen New York AMT-Free Quality Municipal Income Fund ,$13.88 ,-0.02,-0.14%,1210826020,United States,2002,37573,Finance,Trusts Except Educational Religious and Charitable
NRP,Natural Resource Partners LP Limited Partnership,$25.25 ,-0.1,-0.39%,311870477,United States,2002,6928,Energy,Coal Mining
NRT,North European Oil Royality Trust Common Stock,$10.09 ,-0.115,-1.13%,92733053,United States,,30466,Energy,Oil & Gas Production
NRUC,National Rural Utilities Cooperative Finance Corporation 5.500% Subordinated Notes due 2064 (Subordinated Deferrable Interest Notes),$27.56 ,0.08,0.29%,0,,2019,25674,,
NS,Nustar Energy L.P.  Common Units,$16.50 ,0.36,2.23%,1807285755,United States,,286747,,
NSL,Nuveen Senior Income Fund Common Stock,$5.87 ,0,0.00%,226649341,United States,1999,213929,Finance,Trusts Except Educational Religious and Charitable
NSR,Nomad Royalty Company Ltd. Common Shares,$6.35 ,0.07,1.12%,359764444,,,33318,,
NSS,NuStar Logistics L.P. 7.625% Fixed-to-Floating Rate Subordinated Notes due 2043,$25.08 ,0.02,0.08%,0,United States,,28117,,
NSTB,Northern Star Investment Corp. II Class A Common stock,$9.94 ,0.01,0.10%,497000000,,2021,61507,,
NSTC,Northern Star Investment Corp. III Class A Common Stock,$9.77 ,0,0.00%,488500000,,2021,3729,,
NSTD,Northern Star Investment Corp. IV Class A Common Stock,$9.79 ,0.02,0.21%,489500000,,2021,1163,,
NTB,Bank of N.T. Butterfield & Son Limited (The) Voting Ordinary Shares,$37.20 ,-0.12,-0.32%,1867713680,Bermuda,2016,53208,Finance,Commercial Banks
NTG,Tortoise Midstream Energy Fund Inc. Common Stock,$30.58 ,0.56,1.87%,172562665,,2010,37665,Finance,Finance Companies
NTP,Nam Tai Property Inc. Common Stock,$26.88 ,0.77,2.95%,1055255040,China,,114824,Capital Goods,Industrial Machinery/Components
NTST,NetSTREIT Corp. Common Stock,$23.52 ,-0.56,-2.33%,929651003,United States,2020,126300,Consumer Services,Real Estate Investment Trusts
NTZ,Natuzzi S.p.A.,$18.01 ,0.48,2.74%,197580668,Italy,1993,31457,Consumer Durables,Home Furnishings
NUO,Nuveen Ohio Quality Municipal Income Fund Common Stock,$15.89 ,-0.09,-0.56%,291056415,United States,1991,25736,Finance,Finance/Investors Services
NUVB,Nuvation Bio Inc. Class A Common Stock,$9.11 ,-0.6,-6.18%,1983785237,United States,2020,349391,Health Care,Biotechnology: Pharmaceutical Preparations
NUW,Nuveen AMT-Free Municipal Value Fund,$16.80 ,-0.02,-0.12%,301582445,United States,2009,6477,Finance,Investment Managers
NVGS,Navigator Holdings Ltd. Ordinary Shares (Marshall Islands),$8.75 ,-0.07,-0.79%,674592529,Isle of Man,2013,32510,Transportation,Marine Transportation
NWN,Northwest Natural Holding Company Common Stock,$46.83 ,-0.18,-0.38%,1436403571,United States,,70083,Public Utilities,Oil/Gas Transmission
NX,Quanex Building Products Corporation Common Stock,$21.29 ,-0.45,-2.07%,713678867,United States,,140404,Basic Industries,Metal Fabrications
NXC,Nuveen California Select Tax-Free Income Portfolio Common Stock,$15.75 ,-0.0304,-0.19%,100132027,United States,1992,3947,Finance,Investment Managers
NXJ,Nuveen New Jersey Qualified Municipal Fund ,$15.30 ,0.05,0.33%,634688921,United States,2001,42867,Finance,Finance/Investors Services
